house_name,location,bedroom_count,bathroom_count,carport_count,price,land_area,building_area,jarak_ke_kota_km
Rumah Siap Huni Mainroad Furnish di Budisari Bandung,"Cidadap, Bandung",3,3,0,5600000000,349,370,6.038573662
"RUMAH KOS jl bukit durian dalam,dekat UNPAR Bandung","Cidadap, Bandung",36,24,0,12500000000,1193,571,6.038573662
Rumah di Jl. Budisari I Bandung,"Cidadap, Bandung",3,4,2,5400000000,340,400,6.038573662
Rumah di Bukit Indah,"Cidadap, Bandung",4,3,0,16000000000,900,1000,6.038573662
Turun Harga Rumah Di Jl. Dr. Setiabudi Bandung,"Cidadap, Bandung",5,3,2,18000000000,620,400,6.038573662
Dijual Rumah Hook Di Jl. Cipaku Indah I Bandung,"Cidadap, Bandung",3,2,2,14000000000,1100,600,6.038573662
Rumah di Jl. Budisari I Bandung,"Cidadap, Bandung",3,4,2,5400000000,340,400,6.038573662
"Rumah Minimalis Modern di Budi Indah, Bandung","Cidadap, Bandung",3,4,4,11000000000,450,450,6.038573662
Rumah Kost masih berjalan baik. letak deket Unpar,"Cidadap, Bandung",37,20,3,7600000000,335,650,6.038573662
Rumah Nice View 4 Kamar Tidur Taman Luas Citra Green Dago,"Cidadap, Bandung",5,4,5,13000000000,780,400,6.038573662
DESAIN RUMAH UNIK & MEMILIKI BANYAK JENDELA UNTUK SIRKULASI CAHAYA & UDARA,"Cidadap, Bandung",3,2,0,2700000000,255,158,6.038573662
Rumah Terawat 2 Lantai di Jl. Cipaku Indah Bandung,"Cidadap, Bandung",4,3,3,5000000000,490,400,6.038573662
Turun Harga Rumah Di Jl. Dr. Setiabudi Bandung,"Cidadap, Bandung",5,3,2,18000000000,620,400,6.038573662
Rumah Villa cantik nyaman di Punclut,"Cidadap, Bandung",4,3,13,8000000000,932,400,6.038573662
Rumah di Ciumbuleuit dekat Unpar bandung,"Cidadap, Bandung",0,0,0,6000000000,218,175,6.038573662
Rumah Besar Budisari,"Cidadap, Bandung",3,2,2,6400000000,400,274,6.038573662
"Rumah Vila asri Dago , ada kolam renang , siap huni area Buniwangi Dago ","Cidadap, Bandung",5,5,5,12000000000,1400,1200,6.038573662
Rumah 2 Lantai Budisari Siap Huni,"Cidadap, Bandung",4,3,0,7950000000,631,450,6.038573662
"Rumah di Sayap Hegarmanah, Komp Cikendi Kota Bandung","Cidadap, Bandung",5,4,0,3300000000,243,300,6.038573662
Rumah 4 Lantai SHM Bagus di sayap Ciumbuleuit,"Cidadap, Bandung",3,3,1,2300000000,100,250,6.038573662
Puncak Kebahagiaan Beli Rumah di Budi Indah Bandung Kota,"Cidadap, Bandung",3,2,0,7900000000,450,300,6.038573662
Rumah murah harga NJOP,"Cidadap, Bandung",3,2,1,2900000000,260,195,6.038573662
"komplek dreamhill (bukit idaman), bandung utara","Cidadap, Bandung",5,3,1,5200000000,500,425,6.038573662
Rumah Baru di Rumah Kenari Kebon Kopi Rancabentang Bandung,"Cidadap, Bandung",3,3,1,1180000000,72,71,6.038573662
Rumah klasik terawat komplek budisari bandung,"Cidadap, Bandung",5,2,1,6250000000,546,400,6.038573662
Rumah Kost 15 Pintu Dekat ITB Bandung,"Cidadap, Bandung",15,5,0,2500000000,198,198,6.038573662
Rumah Mewah Bagus 2 Lantai di Komplek Dago Pandawa Ciumbuleuit,"Cidadap, Bandung",5,5,2,5500000000,253,350,6.038573662
Sale Good Rumah Hook Super Mewah di Batu Indah Bandung Kota,"Cidadap, Bandung",5,4,5,4750000000,513,350,6.038573662
Town house exotic mainroad di dago giri bandung,"Cidadap, Bandung",3,2,1,1800000000,130,131,6.038573662
Rumah 2 lantai di Cidadap bandung,"Cidadap, Bandung",5,3,3,3100000000,550,450,6.038573662
Dijual Rumah Cluster Exclusive One Gate System di Dekat Setiabudi,"Cidadap, Bandung",2,2,1,649000000,70,40,6.038573662
Dijual rumah baru minimalis diPadalestari Setiabudi,"Cidadap, Bandung",3,2,1,1900000000,120,160,6.038573662
Di jual rumah di Setiabudi lokasi strategis ,"Cidadap, Bandung",5,3,3,34000000000,1345,500,6.038573662
Hunian Mewah Nyaman View Keren Kota Dan Pegunungan,"Cidadap, Bandung",4,3,3,5500000000,340,300,6.038573662
Rumah Sayap Ciumbeleuit di area Bandung Utara dan View Gunung,"Cidadap, Bandung",3,3,0,4900000000,230,350,6.038573662
Rumah Rasa Villa di Tengah Kota Bandung (Dago),"Cidadap, Bandung",5,6,0,4500000000,236,400,6.038573662
Rumah Rasa Villa di Tengah Kota Bandung (Dago),"Cidadap, Bandung",5,4,0,3500000000,186,190,6.038573662
Good Live Rumah Baru Di Budisari Cidadap Bandung Kota,"Cidadap, Bandung",3,3,2,3750000000,200,300,6.038573662
Yuhuu Rumah Baru Siap Huni Di Budisari Cidadap Bandung Kota,"Cidadap, Bandung",3,3,2,3750000000,200,300,6.038573662
Jual Cepat Rumah Mewah Di Budi Indah Full Furnish Kota Bandung,"Cidadap, Bandung",3,3,0,6500000000,450,300,6.038573662
Rumah 2 Lantai Bagus lux di budi indah view kota bandung,"Cidadap, Bandung",3,3,0,7900000000,450,300,6.038573662
"Rumah Bagus Unfurnished SHM di Komplek Cipaku Indah , Bandung","Cidadap, Bandung",4,2,2,4500000000,357,170,6.038573662
Rumah villa town house siap huni di dago giri bandung,"Cidadap, Bandung",3,2,1,2500000000,291,175,6.038573662
Jual Rumah Villa Lembang Dago Cidadap Bandung Mewah Lokasi Sejuk Asri,"Cidadap, Bandung",5,5,6,16000000000,959,350,6.038573662
Rumah Dijual Cipaku Indah Bandung Mewah Siap Huni,"Cidadap, Bandung",0,3,2,3200000000,180,330,6.038573662
Rumah Dijual Cipaku Indah Bandung Harga Di Bawah Pasar,"Cidadap, Bandung",3,2,1,2900000000,264,195,6.038573662
"komplek dreamhill (bukit idaman), bandung utara","Cidadap, Bandung",5,3,1,5200000000,500,425,6.038573662
Rumah Furnished 1 Lantai Di Cipaku Indah,"Cidadap, Bandung",3,2,2,7000000000,510,350,6.038573662
Rumah Luas Modern Siap Huni Strategis di Budi Indah Setiabudi,"Cidadap, Bandung",3,3,3,6500000000,450,300,6.038573662
Hitung tanah!!! Rumah tua di gunung mas ciumbuluit,"Cidadap, Bandung",8,4,7,31800000000,6072,440,6.038573662
"Dijual Rumah Nyaman Terawat Siap Huni di Regency Budi Indah, Bandung","Cidadap, Bandung",5,3,2,3900000000,360,256,6.038573662
Rumah Asri ala Belanda dekat Dago  dgn Pusat Kota Bandung,"Coblong, Bandung",10,5,1,31000000000,898,650,3.551341755
Dijual Rumah di Mainroad Sayap Dago Kawasan Komersil Kota Bandung,"Coblong, Bandung",7,3,2,32000000000,892,1300,3.551341755
"Rumah 2 Lantai Bagus Unfurnished SHM di Coblong, Bandung","Coblong, Bandung",14,13,1,2900000000,200,340,3.551341755
"Kost an aktif deket kampus ITB, UNPAD, UNPAR dll di dago bandung","Coblong, Bandung",29,29,4,8500000000,311,500,3.551341755
"LANGKA! Rumah Nyaman 2 Lantai di Tubagus Ismail, Sayap Dago, Bandung!","Coblong, Bandung",6,4,1,4800000000,290,250,3.551341755
"Rumah Homey 3 Lantai SHM di Bukit Dago Utara , Bandung","Coblong, Bandung",5,4,2,7500000000,232,300,3.551341755
Rumah Strategis Untuk Segala Usaha Mainroad Cisitu Indah Bandung,"Coblong, Bandung",9,4,6,35000000000,1738,950,3.551341755
Rumah Kos Aktif Bangunan Baru Akses 1 Mobil di Sayap Dago Bandung,"Coblong, Bandung",9,9,0,2150000000,100,270,3.551341755
Rumah Strategis Untuk Segala Usaha di Mainroad Cihampelas Bandung,"Coblong, Bandung",6,3,4,25000000000,460,400,3.551341755
Kost- kostan 2 lantai deket ITB di Sayap babak siliwangi,"Coblong, Bandung",18,6,0,2400000000,230,400,3.551341755
"Dijual Rumah Mewah 2 Lantai Bisa Usaha di Mainroad Cihampelas, depan bentuk ruko","Coblong, Bandung",3,3,6,16000000000,362,444,3.551341755
"Rumah cantik 3 Lantai ,strategis, SHM Sudah Renovasi","Coblong, Bandung",4,3,0,1300000000,100,250,3.551341755
Kostan aktif & selalu penuh di Sekeloa dekat kampus Unpad,"Coblong, Bandung",38,38,0,3500000000,392,550,3.551341755
"Asri Dan Nyaman, Sekitar Gasibu, Unpad, Dipati Ukur Dan Dago","Coblong, Bandung",4,2,1,998000000,135,200,3.551341755
"Rumah Mewah Bagus di Resort Dago Pakar, Bandung","Coblong, Bandung",5,4,2,5500000000,554,360,3.551341755
Dijual Rumah Dan Kost Di Sekeloa Kota Bandung,"Coblong, Bandung",15,15,0,6500000000,350,321,3.551341755
RUMAH 2 lt dlm cluster Cisitu dekat ITB KOTA COBLONG BANDUNG,"Coblong, Bandung",4,3,2,2200000000,130,131,3.551341755
Rumah Lama Zona Komersial 745 m² Dihitung Tanah Jl Tamansari,"Coblong, Bandung",7,4,12,23000000000,745,280,3.551341755
Dijual Rumah Kost Kost An di Taman Sari Baltos Dekat Itb Ciwalk,"Coblong, Bandung",20,20,3,3850000000,146,410,3.551341755
"Hunian Mewah Exclusive Strategis Cigadung, Dago, Bandung Utara.","Coblong, Bandung",4,3,2,3400000000,135,224,3.551341755
"Rumah kost area premium dago bandung, dekat Unikom, UNPAD, ITHB","Coblong, Bandung",6,4,1,2000000000,112,250,3.551341755
"Dijual Rumah Bagus SHM di Ir.h.djuanda, Coblong, Bandung","Coblong, Bandung",5,2,0,13500000000,408,350,3.551341755
Dijual!! Kosan Cantik Aktif Income Bagus dekat ITB UNPAD Bandung,"Coblong, Bandung",20,20,2,3850000000,146,310,3.551341755
"Rumah Unik Joglo Antik high class Classical Architecture di Bekasi, Full Furnished Etnis Klasik Dekat Cawang Dan Bandara Halim","Coblong, Bandung",6,3,2,12900000000,410,600,3.551341755
Rumah Tengah Kota di Gg Mesjid Aseng Cihampelas,"Coblong, Bandung",2,2,0,1200000000,135,130,3.551341755
Kost Aktif Area Dago Dkt Kampus Unpas Unisba ITB ROI 10 th,"Coblong, Bandung",20,20,0,3850000000,146,310,3.551341755
Hunian Mewah Ada Kolam Air Hangat Cigadung Dago Bandung Utara.,"Coblong, Bandung",4,4,2,4300000000,203,228,3.551341755
"Rumah Kost Aktif 12 Kamar Tidur di Sayap Dipati Ukur, Bandung","Coblong, Bandung",12,12,1,3500000000,223,320,3.551341755
Rumah di Sayap Dago Sadang Serang Minimalis,"Coblong, Bandung",4,2,1,1660000000,89,178,3.551341755
"Kosan 3 Lantai Lokasi Strategis, Pasif Income di Cisitu, Bandung","Coblong, Bandung",9,9,0,2100000000,70,253,3.551341755
HOT DEAL SALE!! YUK MILIKI Rumah & Kost Bagus 2 Lantai SHM Dago Coblong,"Coblong, Bandung",14,13,1,2900000000,200,340,3.551341755
Jual Cepat Rumah Unik Minimalis Paling Dicari di Sekeloa,"Coblong, Bandung",0,0,0,1500000000,100,250,3.551341755
Jual Cepat Rumah Modern Paling Dicari di Sadang Serang ,"Coblong, Bandung",6,4,0,3100000000,166,240,3.551341755
Jual Cepat Rumah 2 Lantai di Sadang Serang,"Coblong, Bandung",4,3,0,1800000000,114,250,3.551341755
"Hunian Mewah Exclusive Strategis Cigadung, Dago, Bandung Utara.","Coblong, Bandung",4,3,2,3400000000,135,224,3.551341755
"Rumah 2 Lantai Shm Siap Huni di Mainroad Cihampelas, Bandung","Coblong, Bandung",6,5,0,24000000000,460,346,3.551341755
Dijual Rumah Murah Lokasi Strategis di Dago Kawasan Komersil,"Coblong, Bandung",15,7,6,19000000000,1295,400,3.551341755
Rumah blkg Telkom Gasibu SHM Butuh Renov Hadap Utara,"Coblong, Bandung",6,2,1,5000000000,230,200,3.551341755
Dijual!! Kosan Strategis Siap Huni di Sayap Tubagus dekat Raya Dago,"Coblong, Bandung",5,2,0,800000000,106,106,3.551341755
"Jual Cepat harga murah sayap dago , Rumah Nyaman 2 Lt Sadang Serang Sayap Tubagus Ismail Cikutra Dago Bandung","Coblong, Bandung",5,2,1,1400000000,98,170,3.551341755
Rumah Kost Lux Investasi Terbaik di Dago Bandung,"Coblong, Bandung",20,14,5,4500000000,343,300,3.551341755
Rumah Murah Nyaman Siap Huni Tubagus Ismail Dago,"Coblong, Bandung",7,6,4,5000000000,319,350,3.551341755
Rumah Lux Dan Mewah Strategis Di Komplek Dago Dekat  ITB Bandung ,"Coblong, Bandung",5,3,3,6000000000,330,250,3.551341755
DIJUAL RUMAH KOST MURAH STRATEGIS DIPATIUKUR,"Coblong, Bandung",22,19,2,5500000000,600,700,3.551341755
"Rumah Dijual di Dago, Posisi Bagus Strategis di Pinggir Jalan","Coblong, Bandung",1,1,3,13000000000,463,205,3.551341755
Dijual Rukost elit di tubagus Ismail di bandung ,"Coblong, Bandung",44,44,15,16300000000,1586,1000,3.551341755
"For Sale, Rumah dan kosan super nyaman di Bandung","Coblong, Bandung",0,0,0,27500000000,700,1000,3.551341755
"Full Terisi 44 Kamar,, Jual Rumah Kosan Dekat Kampus Itb","Coblong, Bandung",44,44,8,20000000000,1586,1000,3.551341755
Resor Dago Pakar,"Coblong, Bandung",5,5,10,18500000000,1260,900,3.551341755
Cipaganti,"Coblong, Bandung",10,8,5,19500000000,568,1100,3.551341755
Resor Dago Pakar,"Coblong, Bandung",6,5,6,18000000000,1260,900,3.551341755
Supratman,"Coblong, Bandung",4,10,6,35000000000,850,700,3.551341755
JUAL RUMAH TINGGAL + KOSAN DI CISITU DAGO,"Coblong, Bandung",36,36,7,17000000000,756,1500,3.551341755
"Rumah Jl. Bukit Dago Utara, Dago, Coblong, Kota Bandung","Coblong, Bandung",5,4,0,14500000000,822,822,3.551341755
Rumah Dijual di Cipaganti Bandung,"Coblong, Bandung",2,3,0,25000000000,772,150,3.551341755
Jual rumah kost Cihampelas Pusat Kota Bandung,"Coblong, Bandung",8,4,2,2500000000,80,168,3.551341755
Jual Rumah Bagus Asri Jalan Utama Dipati Ukur Pusat Kota Bandung,"Coblong, Bandung",5,5,3,31000000000,743,250,3.551341755
Dijual Lelang Rumah Klasik Terawat di Sayap Dipatiukur,"Coblong, Bandung",2,2,0,10200000000,650,275,3.551341755
Rumah Harga Miring Strategis di Coblong Bandung,"Coblong, Bandung",6,4,5,14800000000,650,487,3.551341755
Rumah 2 Lantai Lux Baru di Mainroad Cipaganti Bandung,"Coblong, Bandung",3,3,0,7000000000,190,210,3.551341755
Rumah Dan Kost An Siap Huni di Sayap Tamansari Coblong,"Coblong, Bandung",11,5,5,38000000000,1540,700,3.551341755
"RUMAH CANTIK DAN STRATEGIS! Rumah 2 Lantai Alamanda Dago, Siap Huni!","Coblong, Bandung",5,3,1,9000000000,443,243,3.551341755
Rumah Bagus Dan Asri Di Tubagus Ismail Bandung,"Coblong, Bandung",4,5,1,8000000000,550,293,3.551341755
Rumah daerah Gedung Sate Bandung,"Coblong, Bandung",3,2,1,4000000000,320,170,3.551341755
Rumah Dijual Cepat Lokasi Premium Sayap Cipaganti Coblong Bandung,"Coblong, Bandung",4,3,1,2650000000,246,150,3.551341755
Kos Mewah Belakang Gedung Telkom Gazibu Bandung Harga Nego !!,"Coblong, Bandung",12,13,1,3500000000,223,320,3.551341755
"Dijual Rumah Luas View Taman di Cipaganti, Bandung","Coblong, Bandung",1,1,0,49500000000,1100,400,3.551341755
"Rumah di Dipati Ukur, Mainroad Cocok Untuk Usaha, Kantor","Coblong, Bandung",6,4,6,45000000000,995,400,3.551341755
"Strategis, Rumah Siap Huni Mainroad Dipati Ukur Cocok Untuk Usaha ","Coblong, Bandung",6,4,6,45000000000,995,400,3.551341755
Rumah Murah Strategis Di Sayap Cipaganti Kota Bandung,"Coblong, Bandung",8,8,2,10000000000,328,400,3.551341755
Rumah Strategis Lux Mewah Di Pusat Kota Cipaganti Bandung,"Coblong, Bandung",6,7,6,19500000000,568,750,3.551341755
"Rumah 3 Lantai di Cisitu Indah Hadap Timur, Dago","Coblong, Bandung",8,5,2,3500000000,140,400,3.551341755
"Rumah Kost Kawasan Sekeloa, di Gang Kubangsari Vii","Coblong, Bandung",7,4,0,490000000,98,120,3.551341755
Rumah Langka Belanda Terawat di Main Road Dipatiukur Bandung,"Coblong, Bandung",23,10,0,79500000000,2122,901,3.551341755
Rumah Langka Belanda Terawat di Main Road Dipatiukur Bandung,"Coblong, Bandung",23,10,0,79500000000,2122,901,3.551341755
Turun Harga Rumah Kampung Padi Cisitu Siap Huni Lingkungan Asri,"Coblong, Bandung",3,3,1,3650000000,300,135,3.551341755
Dijual Rumah Lokasi Tengah Kota Bandung Dekat Siliwangi,"Coblong, Bandung",4,2,1,7500000000,228,150,3.551341755
Rumah Dijual di Cipaganti Bandung,"Coblong, Bandung",2,3,0,25000000000,772,150,3.551341755
"Rumah 2 lantai di area tubagus Ismail, sayap dago 3 m an","Coblong, Bandung",3,2,2,3000000000,127,150,3.551341755
Rumah dekat Gedung Sate Bandung,"Coblong, Bandung",5,3,1,14000000000,466,350,3.551341755
Kosan Murah Income Besar di Tengah Kota Sadang Serang Syp Tubagus Ismail Dago,"Coblong, Bandung",6,6,1,650000000,127,250,3.551341755
Rumah Kos Bagus Sayap Dipatiukur Bandung,"Coblong, Bandung",22,18,2,4800000000,600,700,3.551341755
Dijual Kostan di Jl Cisitu Lama - Bandung,"Coblong, Bandung",52,35,0,10500000000,500,1250,3.551341755
Dijual Rumah di Jl. Tikukur Dekat Gedung Sate,"Coblong, Bandung",6,3,2,7000000000,392,300,3.551341755
Dijual Rumah di Jl. Sangkuriang - Bandung,"Coblong, Bandung",8,5,0,2.25E+11,5468,510,3.551341755
Rumah di Jl. Pager Gunung Dago - Bandung,"Coblong, Bandung",8,4,0,30000000000,898,650,3.551341755
Rumah di Jl. Ir. H. Djuanda - Dago,"Coblong, Bandung",10,5,0,1.26E+11,2822,500,3.551341755
Rumah Bagus di Komp. Alamanda - Bandung,"Coblong, Bandung",6,4,2,6800000000,444,660,3.551341755
Dijual Rumah di Dipatiukur Hanya Hitung Tanah,"Coblong, Bandung",4,1,0,11000000000,300,300,3.551341755
Rumah Bagus Parkiran Luas Strategis di Sayap Dago Bandung,"Coblong, Bandung",3,1,6,24500000000,650,250,3.551341755
Forsale Ruang usaha dikawasan asri dago bandung,"Coblong, Bandung",4,4,12,15500000000,790,1020,3.551341755
Rumah Mewah Luas di Sayap Cipaganti Bandung,"Coblong, Bandung",5,4,3,26000000000,830,812,3.551341755
Dijual Rumah di Jl. Sangkuriang - Bandung,"Coblong, Bandung",8,5,2,2.25E+11,5468,510,3.551341755
Dijual Rumah di Jl. Bukit Dago Utara III - Bandung,"Coblong, Bandung",5,4,1,5500000000,232,400,3.551341755
Rumah Titimplik Dalam Cocok Untuk Kost,"Coblong, Bandung",18,2,0,3100000000,172,108,3.551341755
Tempat Usaha (Car Wash) Daerah Ramai di Tubagus Ismail Bandung,"Coblong, Bandung",0,0,0,13500000000,600,250,3.551341755
Rumah Terawat di Mainroad Jl Dipatiukur Bandung,"Coblong, Bandung",6,3,1,40000000000,930,300,3.551341755
"Hanya Sisa 1, Ruko di Sayap Jl Suci / Pasupati","Coblong, Bandung",1,2,2,1900000000,95,140,3.551341755
Dijual Rumah Siap Huni Sayap Tubagus Ismail Cigadung Dekat Dago,"Coblong, Bandung",4,3,1,3700000000,162,210,3.551341755
Dijual Rumah Baru Lux Modern di Sayap Tubagus Ismail Dkt Cigadung,"Coblong, Bandung",4,3,1,3500000000,173,235,3.551341755
Rumah mewah di Summarecon Bandung,"Gede Bage, Bandung",5,3,1,2800000000,105,104,11.18144002
Rumah Premium Modern Summarecon Bandung,"Gede Bage, Bandung",4,3,2,2710000000,117,122,11.18144002
Rumah Cantik Amanda Premium Siap Huni Summarecon Gedebaga Bandung,"Gede Bage, Bandung",4,4,1,2800000000,128,150,11.18144002
Rumah Mewah 2 Lantai Summarecon Gedebage Bandung Dekat Al Jabar Akses Tol Mudah Siap Huni,"Gede Bage, Bandung",4,3,2,2600000000,135,142,11.18144002
Rumah 2 lantai dekat ke Terminal Riung Bandung & Summarecon,"Gede Bage, Bandung",2,1,0,433000000,66,60,11.18144002
"Rumah 2 lantai dekat area perkantoran, dalam kota Bandung. Fasiltas mall, RS, Sekolah, rumah ibadah.","Gede Bage, Bandung",4,3,2,2600000000,120,115,11.18144002
RUMAH SUMMARECON NEW DESIGN CLUSTER GENOVA FASILITAS HOTEL BINTANG 5,"Gede Bage, Bandung",3,2,0,2600000000,120,105,11.18144002
Rumah Luxury di Summarecon Bandung,"Gede Bage, Bandung",5,4,3,5000000000,228,252,11.18144002
Rumah Siap Huni Di Cluster Flora Summarecon,"Gede Bage, Bandung",3,2,1,2200000000,90,75,11.18144002
Rumah Baru Summarecon bandung cluster emily,"Gede Bage, Bandung",4,3,1,10000000000,300,375,11.18144002
rumah murah bumi Adipura 2 lantai Gedebage kota bandung,"Gede Bage, Bandung",3,2,1,597000000,90,120,11.18144002
Dijual Rumah Baru Cluster Flora Summarecon Kota Bandung,"Gede Bage, Bandung",4,2,0,2600000000,105,90,11.18144002
Dijual Rumah Bagus Cluster Flora Siap Huni Di Summarecon Bandung,"Gede Bage, Bandung",4,2,0,2300000000,105,97,11.18144002
Btari Summarecon Bandung Jarang ada...,"Gede Bage, Bandung",3,2,1,2850000000,162,124,11.18144002
Dijual Rumah Cluster Flora Freya Premium Summarecon Gedebage,"Gede Bage, Bandung",4,2,1,2450000000,105,104,11.18144002
"Murah Rumah Minimalis Komplek Grand Sharon, Bandung ","Gede Bage, Bandung",4,3,0,1950000000,180,120,11.18144002
1m an  RUMAH Minimalis SUMMARECON BANDUNG,"Gede Bage, Bandung",2,2,1,1150000000,66,54,11.18144002
Rumah 2 Lantai SHM Baru,"Gede Bage, Bandung",2,2,1,1600000000,108,62,11.18144002
Jual murah rumah minimalis Riung Bandung di Riung Bandung ,"Gede Bage, Bandung",4,2,2,1100000000,108,150,11.18144002
 For Sale Rumah Summarecon Bandung ,"Gede Bage, Bandung",2,2,1,1150000000,66,54,11.18144002
Halaman belakang sdh direnovasi @ Cluster Amanda Summarecon ,"Gede Bage, Bandung",4,3,1,2200000000,112,140,11.18144002
Rumah di Komplek bumi adipura Dekat Summarecon Bandung,"Gede Bage, Bandung",2,1,0,850000000,90,42,11.18144002
Rumah Potensi Passive Income Di Summarecon Yang Apik Menarik Jangan Cuma Dilirik Yuk Segera Miliki...,"Gede Bage, Bandung",2,2,1,1900000000,117,100,11.18144002
Rumah Siap Huni di Summarecon Btari Bandung,"Gede Bage, Bandung",4,4,0,4200000000,180,215,11.18144002
NEW HOUSE MINIMALIS @ SUMMARECON,"Gede Bage, Bandung",2,2,0,1250000000,66,62,11.18144002
Dijual Cepat! Rumah Adipura Tahap 1 Posisi Depan Jarang Ada,"Gede Bage, Bandung",3,1,1,575000000,84,60,11.18144002
Jual Rumah 2 Lantai Sudah RENOV di Cluster Amanda Summarecon Bandung,"Gede Bage, Bandung",4,3,1,4000000000,144,172,11.18144002
Summarecon Bandung Cluster Cynthia - Rumah Minimalis Hommy Siap Huni - Turun Harga Jual Cepat (Good Invest),"Gede Bage, Bandung",4,3,1,3300000000,164,140,11.18144002
Summarecon Bandung Cluster Dayana - Full Furnished Siap Huni Sudah Full Bangunan - Jual Cepat Murah (Good Invest),"Gede Bage, Bandung",2,2,1,1350000000,66,54,11.18144002
Rumah di Summarecon hrga di bawah apprasial bank di cluster Amnda,"Gede Bage, Bandung",4,4,1,2650000000,144,157,11.18144002
Rumah di Summarecon Bandung cluster dayana,"Gede Bage, Bandung",2,2,1,1150000000,66,54,11.18144002
Rumah 2 Lantai Di Summarecon Cluster Amanda Bandung,"Gede Bage, Bandung",2,2,1,2900000000,128,133,11.18144002
Rumah di Summarecon Dayana Bagus menghadap utara dan sudah SHM,"Gede Bage, Bandung",2,2,1,1300000000,66,54,11.18144002
RUMAH MEWAH NEW DESIGN CLUSTER GENOVA SUMMARECON BANDUNG ,"Gede Bage, Bandung",4,3,2,3360000000,150,135,11.18144002
RUMAH BARU BTARI SUMMARECON SUPER MURAH HARGA DIBAWAH NJOP,"Gede Bage, Bandung",0,0,0,2850000000,180,136,11.18144002
Rumah summarecon amanda dijual cepat,"Gede Bage, Bandung",3,3,1,2800000000,112,132,11.18144002
Cluster Adipura Gede Bage Soekarno Hatta ,"Gede Bage, Bandung",2,1,1,650000000,72,50,11.18144002
Rumah Promo Dp 5 Jt Di Ciwastra Buahbatu Bandung,"Gede Bage, Bandung",2,1,1,570000000,60,40,11.18144002
RUMAH BAGUS  dekat kicc 2Lantai  SUMARECCON BANDUNG,"Gede Bage, Bandung",2,2,1,1950000000,105,118,11.18144002
Dijual Cepat Rumah Minimalis Di Summarecon Bandung Siap Huni,"Gede Bage, Bandung",2,2,0,1350000000,66,70,11.18144002
"LIMITED UNIT RUMAH SUMMARECON BANDUNG CLUSTER EMILY TYPE PREMIUM,PRIME LOCATION","Gede Bage, Bandung",4,3,2,6500000000,302,253,11.18144002
"Komp. Bumi Adipura, Gedebage, Kota Bandung. Dekat Masjid Al Jabbar Dan Summarecon","Gede Bage, Bandung",2,1,1,600000000,84,60,11.18144002
Dijual CEPAT RUMAH CANTIK di Summarecon Cluster FLORA,"Gede Bage, Bandung",3,2,0,1890000000,90,75,11.18144002
Dijual Rumah Riung Bandung Permai ,"Gede Bage, Bandung",2,1,1,650000000,144,100,11.18144002
Rumah cantik di pinggir jalan ramai di Sapan Gedebage,"Gede Bage, Bandung",4,2,1,1850000000,140,200,11.18144002
Rumah Model Eropa Di Ciwastra Gedebage Bandung Kpr Dp5 Jt,"Gede Bage, Bandung",2,1,1,570000000,60,40,11.18144002
Dipasarkan Rumah Model Eropa Di Ciwastra Gedebage Kpr Dp 5jt,"Gede Bage, Bandung",2,1,1,670000000,72,45,11.18144002
Jual Rumah Bagusnya Bikin Melongo Sangat Siap Huni Di Summarecon Bandung,"Gede Bage, Bandung",3,3,10,2950000000,144,157,11.18144002
"Limited Unit Rumah Summarecon Bandung ,cluster Emily Semi Furnish","Gede Bage, Bandung",4,3,2,6500000000,302,253,11.18144002
Rumah 2 Lantai di Cluster Cynthia Summarecon Bandung,"Gede Bage, Bandung",3,3,1,2750000000,120,142,11.18144002
Rumah Bangunan BARU 2 Lantai di SUMMARECON Bandung,"Gede Bage, Bandung",3,3,1,3200000000,135,147,11.18144002
Rumah 2 Lantai Summarecon Bandung Cluster Dayana,"Gede Bage, Bandung",3,2,1,2250000000,105,130,11.18144002
Turun Harga Dijual Rumah Summarecon Bandung Cluster Dayana Bangunan Baru ,"Gede Bage, Bandung",3,2,1,2350000000,105,130,11.18144002
Dijual Rumah Masih Baru Di Sumarecon .,"Gede Bage, Bandung",3,3,1,4000000000,144,160,11.18144002
" Rumah Unfurnished SHM - Sertifikat Hak Milik di Cisaranten kidul, Gede Bage Bagus","Gede Bage, Bandung",5,3,3,3700000000,600,450,11.18144002
Rumah Murah di Gede Bage Strategis Dekat Jl Raya Soekarno Hatta,"Gede Bage, Bandung",2,1,1,650000000,84,50,11.18144002
" Rumah di Derwati mas estate, Gede Bage Unfurnished","Gede Bage, Bandung",2,1,1,625000000,72,41,11.18144002
"Rumah Baru 2 Lantai di Cluster Emily Simmarecon, Bandung","Gede Bage, Bandung",5,4,1,7000000000,300,388,11.18144002
Rumah Bagus Like New Grand Pinus Regency Cisaranten Bandung Timur,"Gede Bage, Bandung",3,2,2,1390000000,107,150,11.18144002
Rumah di Summareccon Bandung 1man Siap Huni Harus Laku Bulan Ini,"Gede Bage, Bandung",2,2,1,1350000000,66,66,11.18144002
Promo 5 Juta Bisa Dapet Rumah Baru Dekat Summarecon Bandung,"Gede Bage, Bandung",2,1,1,625000000,62,38,11.18144002
Rumah Baru Murah Dekat Summarecon Bandung,"Gede Bage, Bandung",2,2,1,952000000,69,65,11.18144002
Dijual Rumah Termurah 500 Jutaan di Bumi Adipura Gedebage Bandung,"Gede Bage, Bandung",2,1,1,575000000,84,60,11.18144002
"Rumah Bagus Unfurnished SHM di Summarecon Bandung Cluster Cynthia Type Chelsea Premium, Bandung","Gede Bage, Bandung",3,2,1,1700000000,105,77,11.18144002
Rumah 2 Lantai Di Dayana Sumarecon Bandung,"Gede Bage, Bandung",4,3,2,2300000000,132,130,11.18144002
Rumah Bagus di Komplek Dayana hook 2 Lantai di Summarecon Bandung,"Gede Bage, Bandung",2,2,1,1600000000,109,62,11.18144002
Rumah 2 in 1 siap huni di cluster Dayana Summarecon Bandung,"Gede Bage, Bandung",3,3,0,2300000000,132,130,11.18144002
Rumah mewah murah di perumahan Bumi Adipura Gedebage Bandung dekat Summarecon Bandung dan stasiun Tegaluar,"Gede Bage, Bandung",5,3,0,2100000000,185,180,11.18144002
Rumah Smarthome Free Smartlock Bardi Strategis Di Bumi Panyileukan Bandung KPR,"Gede Bage, Bandung",3,2,0,672000000,61,69,11.18144002
Rumah Smarthome Dekat Sd Al Biruni Bumi Panyileukan Bandung Kpr,"Gede Bage, Bandung",3,2,0,672000000,62,69,11.18144002
Rumah Ready Stock 2summarecon Bandung Cluster Cynthia,"Gede Bage, Bandung",3,2,0,3500000000,120,142,11.18144002
" Rumah Unfurnished SHM - Sertifikat Hak Milik di Summarecon, Gede Bage","Gede Bage, Bandung",2,2,1,1550000000,66,54,11.18144002
Jual Segera Rumah Strategis Di Bumi Adipura Gede Bage Bandung ,"Gede Bage, Bandung",3,2,0,750000000,84,100,11.18144002
Rumah Minimalis di Daerah Kota Baru Gedebage,"Gede Bage, Bandung",2,2,0,1550000000,77,21,11.18144002
Dijual Rumah Nyaman Terawat di Riung Gede Permai Gedebage Bandung,"Gede Bage, Bandung",4,2,1,1300000000,112,120,11.18144002
LINGKUNGAN KONDUSIF Rumah Cluster Islami Dekat Aluna-alun Ujung Berung,"Gede Bage, Bandung",3,2,2,682000000,64,60,11.18144002
Dijual Rumah dalam Cluster di Komplek Bumi Adipura,"Gede Bage, Bandung",2,1,1,850000000,90,42,11.18144002
Rumah Baru 2 Lantai di Summarecon Bandung Cluster Dayana,"Gede Bage, Bandung",2,2,1,1350000000,66,55,11.18144002
