house_name,location,bedroom_count,bathroom_count,carport_count,price,land_area,building_area,jarak_ke_kota_km
"Rumah Main Road Purnawarman Bandung, Sayap Dago","Bandung Wetan, Bandung",10,4,6,21500000000,681,500,1.625303116
Rumah belanda terawat dan rapi,"Bandung Wetan, Bandung",7,4,3,21000000000,877,600,1.625303116
Dijual Rumah di Mainroad Dipenogoro Bandung,"Bandung Wetan, Bandung",4,3,10,60000000000,1791,300,1.625303116
Rumah belanda terawat dan rapi,"Bandung Wetan, Bandung",7,4,3,21000000000,877,600,1.625303116
Dp 10 Rumah Lux di Kalijati Antapani Dkt Cikutra Citarum Bandung,"Bandung Wetan, Bandung",3,2,1,1200000000,66,92,1.625303116
Rumah Hook Lux Singgasana Pradana Kota Bandung,"Bandung Wetan, Bandung",4,5,0,6900000000,286,525,1.625303116
Rumah Usaha Sayap Riau,"Bandung Wetan, Bandung",7,2,0,7900000000,341,270,1.625303116
"Dijual Butuh Cepat Rumah Dekat Kiara Artha Park , Kota Bandung.","Bandung Wetan, Bandung",5,3,1,5200000000,345,400,1.625303116
Rumah Mainroad di Cibolerang,"Bandung Wetan, Bandung",12,8,0,2850000000,312,400,1.625303116
Dijual Rumah Cantik Modern Furnish Di Cihapit Bandung,"Bandung Wetan, Bandung",5,0,0,7000000000,176,270,1.625303116
DIJUAL HOTEL BUTIK DI SAYAP RIAU,"Bandung Wetan, Bandung",24,24,0,22500000000,630,1100,1.625303116
Rumah belanda di tengah kota harga menarik,"Bandung Wetan, Bandung",5,3,2,12000000000,450,375,1.625303116
Rumah besar bandung kabupaten,"Bandung Wetan, Bandung",3,3,1,4500000000,728,200,1.625303116
Rumah Bagus Di  Jln Cipaganti Kota  Bandung,"Bandung Wetan, Bandung",7,3,3,45000000000,1332,400,1.625303116
RUMAH MURAH HERITAGE DI SAYAP RIAU BANDUNG,"Bandung Wetan, Bandung",3,1,3,8740000000,437,250,1.625303116
Rumah Asri Murah Banget di Citarum Bandung Kota,"Bandung Wetan, Bandung",5,4,3,14000000000,451,328,1.625303116
Jual Rumah di Sayap Riau Bandung SHM Bagus Strategis ,"Bandung Wetan, Bandung",7,7,5,13000000000,405,250,1.625303116
Aset Termurah Rumah Strategis di Jl.diponegoro Bandung,"Bandung Wetan, Bandung",8,10,5,27100000000,1416,1000,1.625303116
"For Sale, Kost-Kostan bagus super nyaman di Bandung","Bandung Wetan, Bandung",0,0,0,2000000000,110,200,1.625303116
Rumah Cihapit Sayap Jl A Yani Sayap Jl Riau Bandung Tengah,"Bandung Wetan, Bandung",4,3,0,11000000000,400,200,1.625303116
Mainroad Riau Rumah Lama Lokasi Premium Hitung Tanah,"Bandung Wetan, Bandung",4,2,4,54000000000,1464,700,1.625303116
Rumah Siap Huni Minimalis Di Batunuggal Mulia Bandung,"Batununggal, Bandung",4,3,1,3970000000,325,216,3.71253599
"Rumah Modern Minimalis di Batununggal, Bandung","Batununggal, Bandung",3,2,0,2850000000,162,200,3.71253599
Rumah SHM Bagus hadap Timur,"Batununggal, Bandung",6,5,1,3000000000,260,400,3.71253599
"Rumah SHM Lokasi Strategis di Salendro Timur Vii, Batununggal, Bandung","Batununggal, Bandung",5,3,1,2600000000,200,340,3.71253599
Rumah Siap Huni Design Modern 2 Lantai di Batununggal Bandung,"Batununggal, Bandung",4,4,2,5200000000,220,295,3.71253599
Jual Rumah Batununggal Terawat Bagus,"Batununggal, Bandung",4,4,2,3900000000,240,380,3.71253599
"Rumah Siap Huni di Batununggal Lestari, Bandung","Batununggal, Bandung",4,4,2,5200000000,220,295,3.71253599
Rumah Cantik Mewah di Batununggal Bandung,"Batununggal, Bandung",3,3,3,4300000000,200,250,3.71253599
Rumah Mewah Siap Huni di Batununggal Indah Bandung,"Batununggal, Bandung",5,5,2,9500000000,473,550,3.71253599
"Dijual Rumah Lux 2 Lantai di Batununggal, Bandung","Batununggal, Bandung",3,3,0,3000000000,126,180,3.71253599
Rumah Cluster One Gate di Batununggal Jelita,"Batununggal, Bandung",3,2,2,6250000000,280,290,3.71253599
"Rumah Minimalis Siap Huni Dekat Tol di Batununggal, Bandung","Batununggal, Bandung",4,4,2,5200000000,220,295,3.71253599
Rumah Bagus Hdp Utara di Batununggal Indah,"Batununggal, Bandung",3,2,1,2850000000,195,170,3.71253599
Dijual Rumah di Batununggal Elok 2 Lantai SHM hadap Timur,"Batununggal, Bandung",4,3,2,5800000000,300,400,3.71253599
Rumah 2 Lantai Bagus Area Batununggal Bandung Semi Furnished,"Batununggal, Bandung",3,2,2,2300000000,150,140,3.71253599
Rumah Keren Murah di Batununggal Bandung,"Batununggal, Bandung",3,3,2,1860000000,84,110,3.71253599
Hot listing rumah di BN harga menarik nego sampai deal,"Batununggal, Bandung",4,3,1,3000000000,180,300,3.71253599
Rumah Bagus 3 Lantai Sayap Buah Batu Suhat Bandung Hook SHM,"Batununggal, Bandung",6,5,1,3900000000,235,450,3.71253599
Turun Harga! Rumah Minimalis di Area Batununggal Buah Batu,"Batununggal, Bandung",3,2,1,1290000000,131,90,3.71253599
"Dijual Cepat, Rumah Pusat Kota Dekat Gedung Sate Cocok Dibangun Kos Kos An","Batununggal, Bandung",4,2,1,1330000000,164,100,3.71253599
"Minimalis Rumah Batununggal 2 Lantai, bandung","Batununggal, Bandung",4,3,2,2100000000,97,113,3.71253599
"Dijual Cepat Rumah 1,5 Lantai di Batununggal","Batununggal, Bandung",3,3,1,4250000000,200,250,3.71253599
Rumah Konsep Bali Baru Minimalis Batununggal Dalam Cluster Favorite,"Batununggal, Bandung",3,3,2,6500000000,285,300,3.71253599
"MURAH di Batununggal cocok untuk Keluarga Sedang/ Kecil, Jarang Ada!","Batununggal, Bandung",3,3,2,1940000000,87,115,3.71253599
Rumah 2 Lantai Mewah 100 di Batununggal Indah Bandung,"Batununggal, Bandung",4,4,2,3950000000,180,202,3.71253599
Rumah Lux Keren Banget Strategis di Batununggal Bandung,"Batununggal, Bandung",4,4,1,6300000000,375,560,3.71253599
"Dijual Rumah 2,5 Lantai Nyaman Siap Huni di Batununggal Jelita Bandung","Batununggal, Bandung",4,4,1,3150000000,180,290,3.71253599
NEW MINIMALIS MODERN @ BATUNUNGGAL,"Batununggal, Bandung",5,3,2,3210000000,161,236,3.71253599
Rumah minimalis dekat Sekolah Aloysius,"Batununggal, Bandung",3,2,1,2000000000,123,83,3.71253599
Rumah Batununggal Bagus Harga OK Siap Pakai,"Batununggal, Bandung",7,3,3,3950000000,199,300,3.71253599
Dijual Rumah Baru di Batununggal Indah Bandung,"Batununggal, Bandung",3,3,2,2000000000,91,120,3.71253599
Dijual Rumah Baru Mewah di Batununggal Bandung,"Batununggal, Bandung",4,4,2,4650000000,200,270,3.71253599
Jual Rumah Minimalis di Batununggal Asih,"Batununggal, Bandung",3,2,2,1950000000,126,108,3.71253599
Di Jual Rumah Batununggal Semi Furnished Siap Huni,"Batununggal, Bandung",3,2,2,2850000000,162,200,3.71253599
Rumah 2 Lantai Murah Dekat Batununggal Indah Estate,"Batununggal, Bandung",2,2,1,1400000000,70,120,3.71253599
Jual Rumah Siap Huni Batununggal Asri,"Batununggal, Bandung",2,1,0,1950000000,126,108,3.71253599
Rumah Baru 2 Lantai Paling Murah di Batununggal Indah Bandung ,"Batununggal, Bandung",3,3,2,1860000000,84,110,3.71253599
Jual Cepat Rumah Siap Huni Batununggal Kota Bandung,"Batununggal, Bandung",5,3,1,3200000000,200,300,3.71253599
Jual Cepat Rumah Siap Huni Batununggal Kota Bandung,"Batununggal, Bandung",5,3,1,3200000000,200,300,3.71253599
Rumah cantik siqp huni di komplek elite Batununggal Indah,"Batununggal, Bandung",5,3,2,4000000000,200,250,3.71253599
Rumah asri 2 lantai dlm.cluster batununggal,"Batununggal, Bandung",4,3,2,3150000000,140,214,3.71253599
Rumah 2 lantai hafap timur di batununggal,"Batununggal, Bandung",4,3,2,3370000000,180,280,3.71253599
Rumah Batununggal shm baru SHM,"Batununggal, Bandung",3,2,2,3400000000,180,110,3.71253599
Rumah Siap Huni Batununggal Raya,"Batununggal, Bandung",5,4,2,6000000000,360,400,3.71253599
"Breathable House Rumah Baru Batununggal ,lokasi Depan","Batununggal, Bandung",4,4,2,5200000000,220,295,3.71253599
Rumah Terawat 2 Lantai di Mainroad Batununggal,"Batununggal, Bandung",3,2,2,4000000000,180,200,3.71253599
Rumah baru di batununggal Indah kota Bandung,"Batununggal, Bandung",3,3,2,2000000000,91,120,3.71253599
Rumah 2 Lantai siap huni di komplek Batununggal Harga Nego SHM,"Batununggal, Bandung",4,3,2,4800000000,300,250,3.71253599
Dijual Rumah Bagus Batununggal ,"Batununggal, Bandung",0,0,0,1750000000,112,100,3.71253599
Rumah 2 Lantai Bagus Siap Huni Di Batununggal Indah Dekat BCA,"Batununggal, Bandung",3,2,1,2400000000,117,180,3.71253599
"Rumah Lux Murah Komplek Elit Batununggal, Bandung","Batununggal, Bandung",4,4,2,3000000000,170,300,3.71253599
"Murah Rumah 2 Lantai Komplek Batununggal Indah, Bandung","Batununggal, Bandung",4,3,1,3100000000,180,280,3.71253599
Rumah di Kompleks Batununggal Indah Minimalis Siap Huni,"Batununggal, Bandung",3,2,1,2850000000,162,200,3.71253599
Rumah Terawat 2 Lantai di Komp. Batununggal Indah Bandung,"Batununggal, Bandung",4,3,0,3600000000,180,300,3.71253599
Rumah Batununggal Indah 2lt,"Batununggal, Bandung",3,3,1,2500000000,117,185,3.71253599
"Nego Keras, Rumah Siap Huni Di Komplek Batununggal Indah, Bandung","Batununggal, Bandung",4,3,2,3400000000,180,300,3.71253599
"Rumah Cantik, Siap Huni, Cluster,  Di Batununggal Indah, Bandung","Batununggal, Bandung",3,2,1,2850000000,162,200,3.71253599
Dijual cepat bt Nunggal bagus murah siap huni bandung selatan,"Batununggal, Bandung",4,1,1,3500000000,220,150,3.71253599
Rumah Baru Last Unit di Cluster Batununggal Indah ,"Batununggal, Bandung",4,3,2,2100000000,97,113,3.71253599
Hot Promo Berlaku Sebelum Lebaran Buy 1 Get 1 Free Rumah Parakan Waas Sayap Batununggal,"Batununggal, Bandung",3,3,1,1450000000,70,120,3.71253599
Turun Harga Rumah Bagus 2 Lantai SHM di Cluster Batununggal ,"Batununggal, Bandung",4,3,1,3200000000,180,250,3.71253599
Perumahan Batu Indah - Bangunan Full Renovasi Siap Huni - Turun Harga Jual Cepat Harga NJOP,"Batununggal, Bandung",7,4,1,1590000000,181,300,3.71253599
Perumahan Batununggal - Bangunan Bagus Minimalis Modern Siap Huni - Turun Harga Jual Cepat (Good Invest),"Batununggal, Bandung",5,4,1,3590000000,180,300,3.71253599
Rumah 2 Lantai Siap Huni di Batununggal Bandung,"Batununggal, Bandung",4,2,0,4000000000,325,216,3.71253599
BAGUS Rumah 2 lantai BATUNUNGGAL,"Batununggal, Bandung",4,3,2,6000000000,375,400,3.71253599
Dijual Cepat Rumah Bagus Terawat Batununggal Harga Menarik,"Batununggal, Bandung",4,3,3,2700000000,268,254,3.71253599
Rumah Terawat di Komplek Batununggal Bandung,"Batununggal, Bandung",4,3,1,3400000000,200,130,3.71253599
Dijual Rumah Kusen Jati 2 Lantai Bagus Timur di Batununggal ,"Batununggal, Bandung",5,3,2,13500000000,600,650,3.71253599
Rumah Mewah Terawat di Batununggal Indah Main Road Harga Nego,"Batununggal, Bandung",5,4,0,3600000000,200,300,3.71253599
Rumah Besar Lingkungan Nyaman di Batununggal,"Batununggal, Bandung",5,5,1,4700000000,513,350,3.71253599
Rumah Mewah Aman dan Nyaman di Batununggal Bandung Selatan,"Batununggal, Bandung",6,3,2,10000000000,425,500,3.71253599
Rumah Murah Siap Huni Bangunan Baru di Batununggal Bandung Selatan,"Batununggal, Bandung",3,3,0,3800000000,220,260,3.71253599
Rumah Minimalis Lingkungan Nyaman di Batununggal,"Batununggal, Bandung",5,5,0,4000000000,169,250,3.71253599
Dijual Rumah Nyaman Siap Huni di Batununggal,"Batununggal, Bandung",4,3,1,4800000000,300,230,3.71253599
"Rumah di Batununggal Molek Lux, Terawat Jarang Ada","Batununggal, Bandung",4,3,2,7200000000,375,360,3.71253599
Rumah Apik di Batununggal Asih - Batununggal Indah Bandung,"Batununggal, Bandung",3,2,1,1950000000,126,108,3.71253599
"Nice Banget, Rumah Keren Siap Huni Lokasi Di Batununggal Mulia, Bandung","Batununggal, Bandung",6,3,2,3200000000,182,180,3.71253599
"Worthed Rumah Baru Renov Siap Huni Banget di Batununggal, Bandung","Batununggal, Bandung",5,5,2,3950000000,182,380,3.71253599
Jual Rumah Siap Huni Batununggal Estate Buah Batu,"Batununggal, Bandung",3,2,1,2700000000,140,120,3.71253599
"Rumah Minimalis Bangunan 2 lantai di Batununggal, Bandung","Batununggal, Bandung",3,3,1,6000000000,300,180,3.71253599
Dijual Cepat Rumah Baru Lux Minimalis Batununggal,"Batununggal, Bandung",3,4,2,3500000000,180,220,3.71253599
Rumah Baru Minimalis 2 Lantai Dalam Komplek,"Batununggal, Bandung",4,3,2,3950000000,180,202,3.71253599
Jual Rumah BARU 2 Lantai di Komplek Batununggal Indah Bandung,"Batununggal, Bandung",3,3,1,3800000000,220,260,3.71253599
"Rumah 2 Lantai Dalam Cluster Aman Dekat Batununggal, Bandung","Batununggal, Bandung",5,3,1,1320000000,112,140,3.71253599
RUMAH KEMBAR MAS,"Batununggal, Bandung",3,2,2,2600000000,240,130,3.71253599
"Murah Rumah Lux Murah Komplek Batununggal Abadi, Bandung","Batununggal, Bandung",4,4,0,6000000000,240,245,3.71253599
Rumah Tinggal Sangat Terawat Dengan Kualitas Bangunan Prima di Batununggal Cocok Untuk Tinggal Sekaligus Home Industri,"Batununggal, Bandung",8,5,2,7250000000,300,750,3.71253599
Jual Rumah 1 Lantai Nyaman,"Batununggal, Bandung",4,3,2,3500000000,239,250,3.71253599
Rumah cantik full furnished siap huni di Batununggal Estate,"Batununggal, Bandung",4,4,1,5950000000,225,350,3.71253599
Dijual Rumah Bagus Baru Murah di Batununggal Bandung,"Batununggal, Bandung",4,4,0,4650000000,200,270,3.71253599
Rumah Strategis Untuk Kantor Dll di Mainroad Jl.terate Bandung,"Batununggal, Bandung",5,4,8,12500000000,780,500,3.71253599
Dijual Rumah Komp Sutra Graha Dekat Batununggal Bandung,"Batununggal, Bandung",6,3,1,1300000000,112,140,3.71253599
Rumah Bagus di komplek Batununggal akses tol Buah batu SHM ,"Batununggal, Bandung",3,4,1,3800000000,220,250,3.71253599
"Di jual Rumah Bagus Unfurnished SHM di Batununggal, Bandung","Batununggal, Bandung",4,4,1,3000000000,258,206,3.71253599
Rumah Nyaman Siap Huni di Batu Indah Batununggal Bandung,"Batununggal, Bandung",4,3,1,2700000000,254,268,3.71253599
Jarang Ada Rumah Ideal Batununggal Bandung ,"Batununggal, Bandung",3,2,0,1850000000,126,108,3.71253599
"Rumah Minimalis Bagus Harga Sangat Murah di Batununggal, Bandung","Batununggal, Bandung",4,3,2,3600000000,200,208,3.71253599
"Rumah Baru Dijual Modern Minimalis di Batununggal Indah, Bandung","Batununggal, Bandung",4,4,2,4650000000,200,270,3.71253599
"Rumah Minimalis Paling Murah di Komplek Batununggal, Bandung","Batununggal, Bandung",3,2,2,1950000000,126,108,3.71253599
"Rumah Minimalis Bagus 2 Lantai Dan SHM di Batununggal, Bandung","Batununggal, Bandung",4,3,1,5100000000,240,375,3.71253599
Rumah dan Ruang Usaha Hoek di Mainroad Jl Leuwi Sari Raya Bandung,"Bojongloa Kidul, Bandung",3,3,1,3050000000,157,165,5.193800646
Dijual Rumah Bagus Siap Huni Terawat Lokasi Strategis di Singgasana Pradana Bandung,"Bojongloa Kidul, Bandung",5,3,1,2700000000,210,267,5.193800646
Dijual Rumah Luxury di Singgasana Pradana Bandung,"Bojongloa Kidul, Bandung",4,4,2,14000000000,400,535,5.193800646
Rumah Murah Siap Huni Dekat Komplek Muara ,"Bojongloa Kidul, Bandung",5,4,2,3300000000,325,250,5.193800646
Dijual Cepat Rumah Terawat di Singgasana Pradana Cluster Exclusive Bandung,"Bojongloa Kidul, Bandung",5,3,3,5000000000,325,350,5.193800646
"Rumah Siap Huni di Singgasana Pradana, Cluster Premium","Bojongloa Kidul, Bandung",4,3,2,4300000000,160,240,5.193800646
Murah Komplek Cluster Siap Huni Sayap Kopo Sauyunan,"Bojongloa Kidul, Bandung",2,1,1,1290000000,111,65,5.193800646
Dijual Rumah Siap Huni Di Komplek Mekarwangi Kota Bandung,"Bojongloa Kidul, Bandung",2,2,0,1850000000,120,100,5.193800646
"Rumah Nyaman Dijual Cepat Siap Huni di Leuwi Anyar, Bandung","Bojongloa Kidul, Bandung",5,5,2,1350000000,165,150,5.193800646
"Rumah Lux Eksklusif Baru di Komplek Singasana Pradana , Bandung","Bojongloa Kidul, Bandung",4,3,2,4300000000,160,240,5.193800646
Dijual Rumah Full Renov Minimalis Modern Singgasana Pradana,"Bojongloa Kidul, Bandung",6,4,1,4990000000,200,375,5.193800646
"Bikin Betah Nih Rumahnya Lux Minimalis Siap Huni di Komplek Singgasana Pradana, 15 Menit Ke Tol Mohamad Toha","Bojongloa Kidul, Bandung",5,4,3,4150000000,157,250,5.193800646
"Rumah Nyaman Bagus SHM di Komplek Singasana Pradana, Bandung","Bojongloa Kidul, Bandung",4,3,1,3000000000,200,150,5.193800646
"Rumah Bagus 2 Lantai SHM di Komplek Singasana Pradana , Bandung","Bojongloa Kidul, Bandung",4,4,2,3700000000,160,230,5.193800646
Rumah Murah Harga Njop Strategis SHM di Kopo Imanuel Bandung,"Bojongloa Kidul, Bandung",6,4,2,5500000000,328,400,5.193800646
"Rumah 2 Lantai Baru HGB di Komplek Mekarwangi , Bandung","Bojongloa Kidul, Bandung",4,3,2,3050000000,116,168,5.193800646
RUMAH SINGGASANA PRADANA Bangunan Lux Lokasi Favorit,"Bojongloa Kidul, Bandung",5,3,1,4500000000,200,300,5.193800646
Jual Asal Laku Rumah Mewah 2 lantai sayap jalan Peta,"Bojongloa Kidul, Bandung",4,3,2,3970000000,270,290,5.193800646
Turun Harga lagi Rumah Lux 2 Lantai di komplek Leuwisari SHM,"Bojongloa Kidul, Bandung",4,3,2,3900000000,270,290,5.193800646
"Rumah nyaman siap huni di Leuwisari, Bandung","Bojongloa Kidul, Bandung",4,3,1,1650000000,178,150,5.193800646
Jarang ada Rumah baru 2 Lantai di Mekar wangi bandung,"Bojongloa Kidul, Bandung",4,3,2,2600000000,150,185,5.193800646
Rumah Leuwi Sari Hoek,"Bojongloa Kidul, Bandung",3,3,2,2250000000,116,117,5.193800646
Rumah Hitung Tanah Saja di Singgasana Pradana Bandung,"Bojongloa Kidul, Bandung",3,3,1,2750000000,238,110,5.193800646
Dijual Rumah Singgasana Pradana,"Bojongloa Kidul, Bandung",3,2,1,3300000000,178,130,5.193800646
For Sale Rumah Terawat @Singgasana,"Bojongloa Kidul, Bandung",3,2,1,2800000000,180,120,5.193800646
Dijual Rumah Singgasana,"Bojongloa Kidul, Bandung",3,3,2,3400000000,141,246,5.193800646
Rumah Nyaman Siap Huni di Singgasana Pradana Bandung,"Bojongloa Kidul, Bandung",3,2,2,5500000000,240,180,5.193800646
Rumah Baru Renov Singgasana Pradana Bandung,"Bojongloa Kidul, Bandung",3,2,3,5500000000,240,180,5.193800646
Rumah Dijual Singgasana Pradana Bandung Siap Huni,"Bojongloa Kidul, Bandung",3,3,2,3400000000,141,246,5.193800646
Dijual Rumah di Komplek Singgasana 2 Lantai Bagus! harga Nego !,"Bojongloa Kidul, Bandung",5,4,2,11000000000,300,550,5.193800646
Rumah Siap Huni Di Komplek Taman Cibaduyut Ref.03482,"Bojongloa Kidul, Bandung",2,2,0,500000000,60,50,5.193800646
Rumah Dijual Singgasana Pradana Bandung Siap Huni,"Bojongloa Kidul, Bandung",0,0,2,3400000000,141,246,5.193800646
Rumah Cantik Nyaman di Singgasana Pradana Bandung,"Bojongloa Kidul, Bandung",3,3,2,3400000000,141,246,5.193800646
"Dijual Rumah Hunian Nyaman 2 Lantai Lokasi Stretegis Singgasana Pradana, Bandung","Bojongloa Kidul, Bandung",4,3,2,4250000000,160,240,5.193800646
 Rumah Semi Furnished Bagus Siap Huni  di Singgasana Pradana,"Bojongloa Kidul, Bandung",3,2,3,5000000000,240,180,5.193800646
"Dijual Rumah Hunian Nyaman Dan Terawat Lokasi di Singgasana Pradana, Bandung","Bojongloa Kidul, Bandung",3,3,2,3400000000,141,246,5.193800646
Dijual Rumah Lux Siap Huni di Singgasana Pradana Bandung,"Bojongloa Kidul, Bandung",3,3,1,3250000000,180,146,5.193800646
Dijual Rumah Mewah Modern di Singgasana Pradana Bandung,"Bojongloa Kidul, Bandung",3,3,1,3800000000,180,180,5.193800646
Rumah Terawat Sategis Siap Huni di Komplek Muara Sari Bandung,"Bojongloa Kidul, Bandung",4,3,2,1900000000,157,145,5.193800646
Dijual Rumah Bagus Nyaman Asri di Mekar Raharja Bandung,"Bojongloa Kidul, Bandung",4,3,1,2650000000,125,155,5.193800646
"Bikin Betah Nih Rumahnya Lux Minimalis Siap Huni di Komplek Singgasana Pradana, 15 Menit Ke Tol Mohamad Toha","Bojongloa Kidul, Bandung",5,4,0,4150000000,157,250,5.193800646
"Dijual Rumah Baru Tengah Kota Bandung di Cluster Leuwisari, Bandung","Bojongloa Kidul, Bandung",3,2,0,1550000000,72,70,5.193800646
"Dijual Rumah Baru 2 Lantai Tengah Kota Bandung Area Leuwisari, Bandung","Bojongloa Kidul, Bandung",3,3,0,1750000000,80,101,5.193800646
"Dijual Rumah Baru Huk 2 Lantai Tengah Kota Di Area Leuwisari, Bandung","Bojongloa Kidul, Bandung",3,3,0,2250000000,117,116,5.193800646
"Dijual Rumah Baru Tengah Kota Bandung di Cluster Leuwisari, Bandung","Bojongloa Kidul, Bandung",3,2,0,1550000000,72,70,5.193800646
"Dijual Rumah Baru 2 Lantai Tengah Kota Bandung Area Leuwisari, Bandung","Bojongloa Kidul, Bandung",3,3,0,1750000000,80,101,5.193800646
"Dijual Rumah Baru Huk 2 Lantai Tengah Kota Di Area Leuwisari, Bandung","Bojongloa Kidul, Bandung",3,3,0,2250000000,117,116,5.193800646
" Rumah Baru Bagus  di Singgasana Pradana, Bojongloa Kidul","Bojongloa Kidul, Bandung",4,3,2,3450000000,148,203,5.193800646
Dijual Rumah Super Murah Harga Njop di Muara Sari Bandung,"Bojongloa Kidul, Bandung",4,3,0,1550000000,200,130,5.193800646
Rumah Baru Minimalis di Lewi Sari Bandung,"Bojongloa Kidul, Bandung",3,2,0,1500000000,72,40,5.193800646
Dijual Rumah Mewah Siap Huni di Singgasana Pradana Bandung,"Bojongloa Kidul, Bandung",4,3,0,11700000000,275,314,5.193800646
Rumah Siap Huni Terawat Nyaman di Singgasana Pradana Bandung,"Bojongloa Kidul, Bandung",3,3,1,3200000000,200,240,5.193800646
Rumah Siap Huni Terawat Lokasi Bagus di Leuwisari Bandung,"Bojongloa Kidul, Bandung",5,3,0,2700000000,320,205,5.193800646
 Rumah Bagus Terawat Nyaman Dan Aman di Komplek Leuwisari ,"Bojongloa Kidul, Bandung",4,3,1,3990000000,270,290,5.193800646
Rumah Siap Huni Semi Furnished di Leuwi Panjang Bandung,"Bojongloa Kidul, Bandung",5,6,2,5500000000,400,236,5.193800646
Rumah 2 Lantai Premium Strategis di Komplek Leuwisari Bandung,"Bojongloa Kidul, Bandung",4,3,1,4400000000,270,290,5.193800646
Jarang Ada Rumah 2 Lantai di Area Singgasana Darma Bandung,"Bojongloa Kidul, Bandung",5,3,2,7770000000,400,500,5.193800646
"Dijual Rumah Hunian Nyaman 2 Lantai Semi Furnished Lokasi di Komplek Singgasana Pradana, Bandung","Bojongloa Kidul, Bandung",3,3,1,3800000000,180,180,5.193800646
Rumah Baru 100 Exclusive One Gate System di Singgasana Bandung,"Bojongloa Kidul, Bandung",4,3,0,3650000000,148,207,5.193800646
Rumah dijual dekat terminal leuwipanjang dekat pasar leuwipanjang,"Bojongloa Kidul, Bandung",3,2,1,1300000000,70,80,5.193800646
Rumah di jual dekat terminal leuwipanjang bandung dekat kantor kelurahan situsaer,"Bojongloa Kidul, Bandung",4,2,1,900000000,182,170,5.193800646
Nego Sampai Jadi Rumah Leuwisari. ,"Bojongloa Kidul, Bandung",7,3,2,10000000000,681,812,5.193800646
Rumah di Singgasana 2 Lantai Hadap Barat,"Bojongloa Kidul, Bandung",4,4,2,14000000000,400,535,5.193800646
Rumah di Singgasana 2 Lantai Hadap Timur,"Bojongloa Kidul, Bandung",4,3,1,4500000000,200,300,5.193800646
Dijual Rumah Super Murah Harga Njop di Muara Sari Bandung,"Bojongloa Kidul, Bandung",4,3,0,1550000000,200,130,5.193800646
Di Jual Rumah Besar Bersih Di Jl Leuwisari,"Bojongloa Kidul, Bandung",5,3,0,2700000000,320,200,5.193800646
Di jual cepat rumah di jln Leuwisari ,"Bojongloa Kidul, Bandung",5,3,0,2700000000,320,200,5.193800646
Rumah Luxury Cantik Dan Elegant di Singgasana Pradana Bandung,"Bojongloa Kidul, Bandung",5,3,3,5600000000,325,300,5.193800646
Rumah di Singgasana Cluster Depan Sudah Renovasi,"Bojongloa Kidul, Bandung",3,3,3,4600000000,258,220,5.193800646
"RUMAH MEGAH 2 LT DI KOMPLEK MUARA DEKAT  PUSAT KOTA, PERKANTORAN","Bojongloa Kidul, Bandung",3,2,1,4000000000,240,300,5.193800646
Dijual Rumah Terawat Murah di Jalan Leuwisari Bandung,"Bojongloa Kidul, Bandung",3,2,0,1650000000,178,150,5.193800646
Rumah di Singgasana Pradana 2 Lantai Baru,"Bojongloa Kidul, Bandung",5,3,0,7000000000,312,350,5.193800646
Rumah di Singgasana Pradana 2 Lantai SHGB,"Bojongloa Kidul, Bandung",4,4,0,4750000000,350,350,5.193800646
Rumah di Singgasana Pradana 2 Lantai Hadap Selatan,"Bojongloa Kidul, Bandung",3,3,3,9750000000,244,300,5.193800646
Dijual Rumah Luxury Murah di Singgasana Pradana Bandung,"Bojongloa Kidul, Bandung",5,4,0,3750000000,145,300,5.193800646
Rumah 2 Lantai Harga Nego Tipis di Komplek Muara Kota Bandung,"Bojongloa Kidul, Bandung",6,4,2,2000000000,200,210,5.193800646
Rumah Murah Sangat Nyaman Siap Huni di Singgasana,"Bojongloa Kidul, Bandung",5,2,1,3600000000,147,370,5.193800646
Rumah Cantik 2 lantai di Singgasana Karangkamulyan,"Bojongloa Kidul, Bandung",4,3,2,3350000000,200,-250,5.193800646
Rumah Dijual Singgasana Pradana Bandung Cluster Favorit,"Bojongloa Kidul, Bandung",4,4,2,12500000000,400,550,5.193800646
Rumah Baru Minimalis di Mekar Mandiri Komplek Mekarwangi,"Bojongloa Kidul, Bandung",4,4,0,3900000000,146,252,5.193800646
Rumah Mewah jalan utama Singgasana Pradana ,"Bojongloa Kidul, Bandung",4,5,4,6900000000,286,525,5.193800646
Rumah di Mekarwangi Singgasana SHM,"Bojongloa Kidul, Bandung",3,2,1,4550000000,252,162,5.193800646
Rumah di Mekarwangi Singgasana 2 Lantai SHM,"Bojongloa Kidul, Bandung",3,2,1,3800000000,250,250,5.193800646
Jual Rumah Baru Modern Minimalis Siap Huni Mekar Wangi Bandung,"Bojongloa Kidul, Bandung",4,3,2,3050000000,116,168,5.193800646
Jarang ada! Jual Nego Rumah baru di Taman Mekar Abadi,"Bojongloa Kidul, Bandung",4,3,2,2600000000,150,185,5.193800646
Dijual Rumah Leuwi Sari Hoek,"Bojongloa Kidul, Bandung",3,3,2,2250000000,116,117,5.193800646
Rumah Dijual 2 Lantai di Moh. Toha Bandung,"Bojongloa Kidul, Bandung",4,2,2,2000000000,214,160,5.193800646
Rumah baru furnish di Dekat terminal Leuwipanjang,"Bojongloa Kidul, Bandung",3,3,2,2250000000,116,117,5.193800646
Jual Rumah Minimalis Karasak Bandung,"Bojongloa Kidul, Bandung",2,2,1,1000000000,94,120,5.193800646
Dijual Rumah Lama Siap Huni Murah Di Komplek Mekarwangi Singgasana Bandung,"Bojongloa Kidul, Bandung",5,3,1,2700000000,210,267,5.193800646
Dijual Rumah Modern Minimalis di Singgasana Pradana Bandung,"Bojongloa Kidul, Bandung",3,3,1,3800000000,180,180,5.193800646
Dijual Rumah di Singgasana Kuta Kencana ,"Bojongloa Kidul, Bandung",4,3,1,11700000000,275,314,5.193800646
Dijual Rumah Baru Modern Nyaman Tengah Kota di Leuwisari,"Bojongloa Kidul, Bandung",3,2,1,1200000000,55,83,5.193800646
"Turun Harga Dijual Rumah di Singgasana Kuta Kencana, Bandung","Bojongloa Kidul, Bandung",4,3,0,11000000000,275,314,5.193800646
Rumah Dijual Singgasana Pradana Bandung Baru Minimalis,"Bojongloa Kidul, Bandung",0,0,3,3950000000,145,300,5.193800646
"Rumah 1,5 Lantai Minimalis di Leuwi Sari Bandung","Bojongloa Kidul, Bandung",3,3,3,5350000000,411,276,5.193800646
Di jual rumah satu lantai lokasi di Jln Cibaduyut lama SHM Bagus,"Bojongloa Kidul, Bandung",5,3,1,2300000000,270,171,5.193800646
Rumah di Singgasana 2 Lantai SHM Bagus,"Bojongloa Kidul, Bandung",4,3,2,4500000000,200,300,5.193800646
Rumah di Mekarwangi 2 Lantai SHM Bagus,"Bojongloa Kidul, Bandung",4,3,2,3800000000,220,280,5.193800646
Rumah di Singgasana Pradana 2 Lantai SHM Baru,"Bojongloa Kidul, Bandung",4,3,2,4500000000,160,240,5.193800646
"Rumah minimalis siap huni lt206/200 hrg1,65m di Margahayu SoekarnoHata","Buah Batu, Bandung",5,4,2,1650000000,206,200,5.260994555
