house_name,location,bedroom_count,bathroom_count,carport_count,price,land_area,building_area,jarak_ke_kota_km
Rumah Bagus Strategis Tengah Kota SHM di Ah Nasution Kota Bandung,"Mandalajati, Bandung",3,2,0,4250000000,303,80,7.138017173
Dijual Rumah Besar Bagus di Jatihandap Bandung,"Mandalajati, Bandung",6,5,6,4200000000,750,400,7.138017173
Rumah Luas 1000m2 Dekat Cicaheum Bandung,"Mandalajati, Bandung",13,4,5,7000000000,1000,600,7.138017173
Rumah Cluster 2 Lantai Siap Huni Bebas Banjir,"Mandalajati, Bandung",3,2,1,1250000000,84,90,7.138017173
Dijual murah rumah mewah 3 lantai di cicaheum bandung,"Mandalajati, Bandung",5,1,2,6500000000,868,600,7.138017173
"MURAH RUMAH SIAP HUNI DI JATIHANDAP DEKAT KE CICAHEUM, SAUNG UJO","Mandalajati, Bandung",2,1,1,550000000,72,36,7.138017173
"Rumah Jl. Ah Nasution, Pasir Impun, Mandalajati, Kota Bandung","Mandalajati, Bandung",5,4,0,9500000000,886,600,7.138017173
Rumah Komp. Green Garden Sangat Murah Dan Nyaman,"Mandalajati, Bandung",0,0,0,650000000,90,90,7.138017173
Rumah Idaman Masa Kini Dikawasan Nyaman di Mandalajati,"Mandalajati, Bandung",4,2,1,1750000000,112,185,7.138017173
"Parah Sih Kalau Di Skip, Rumah Murah Nyaman Di Antapani","Mandalajati, Bandung",2,1,1,850000000,93,60,7.138017173
Jangan Sampai Lolos.. Hunian Baru Desain Keren Area Mandalajati,"Mandalajati, Bandung",3,2,1,1650000000,172,142,7.138017173
Dijual Rumah Minimalis Terawat di Jatihandap Kota Bandung,"Mandalajati, Bandung",5,2,1,875000000,84,128,7.138017173
Rumah Idaman Nuansa Villa View Cantik Lokasi di Mandalajati,"Mandalajati, Bandung",4,2,1,1750000000,112,185,7.138017173
Menarik Kan Rumah Mevvah Cocok Untuk Keluarga Di Area Mandalajati,"Mandalajati, Bandung",4,2,1,1750000000,122,185,7.138017173
Rumah Pasir Impun Komplek Grand Panoramic View City,"Mandalajati, Bandung",3,3,0,1540000000,120,150,7.138017173
Dijual Rumah Cantik Di Pasir Impun Bandung ,"Mandalajati, Bandung",0,2,2,1750000000,109,162,7.138017173
Dijual Rumah Di Pasir Impun Bandung ,"Mandalajati, Bandung",3,2,0,1200000000,84,100,7.138017173
Rumah Hook Ada Pool Mini di Perumahan Tamansari Bukit Bandung,"Mandalajati, Bandung",4,3,2,3900000000,232,400,7.138017173
 Rumah Unfurnished Terawat di Sindanglaya Dekat Apotek Hosana,"Mandalajati, Bandung",5,3,0,1500000000,150,112,7.138017173
Rumah minimalis bangunan baru di jatihandap kota bandung ,"Mandalajati, Bandung",2,1,1,528000000,66,33,7.138017173
Rumah 2 Lantai di Perumahan Daerah Pasir Impun Bandung,"Mandalajati, Bandung",4,4,1,1650000000,122,185,7.138017173
Rumah di pasir impun jual cepat siap huni,"Mandalajati, Bandung",3,2,1,1600000000,105,95,7.138017173
Rumah 2 Lantai Besar Dikomplek Elite Tamansari Bukit Bandung,"Mandalajati, Bandung",10,7,2,6500000000,564,480,7.138017173
Rumah Hook Dikomplek Tamansari Bukit Bandung One Gate System,"Mandalajati, Bandung",4,4,2,3500000000,360,178,7.138017173
Rumah Nyaman Dan Asri Dikomplek Tamansari Bukit Bandung ,"Mandalajati, Bandung",3,1,1,1800000000,160,100,7.138017173
Rumah SHM Bagus di green valley residence,"Mandalajati, Bandung",1,1,1,500000000,60,22,7.138017173
Dijual Rumah Lux di Jatihandap Pasir Impun Cimenyan Bandung,"Mandalajati, Bandung",2,3,5,1800000000,340,120,7.138017173
DIJUAL RUMAH COCOK UTK USAHA DI MAINROAD PASIR IMPUN MANDALAJATI,"Mandalajati, Bandung",2,2,2,1300000000,99,160,7.138017173
DIJUAL RUMAH UTK SEGALA USAHA SIAP PAKAI MAINROAD PASIR IMPUN,"Mandalajati, Bandung",2,6,4,4000000000,560,500,7.138017173
DIJUAL FULLFURNISH RUMAH MSH BARU DI TAMAN MELATI PASIR IMPUN,"Mandalajati, Bandung",4,3,2,1200000000,128,130,7.138017173
DIJUAL SEMIFURNISH RUMAH ASRI CANTIK TERAWAT DI BANDUNG CITYLIGHT,"Mandalajati, Bandung",2,2,2,1600000000,105,115,7.138017173
"Rumah Bagus Semi Furnished SHM di Pasir Impun, Bandung","Mandalajati, Bandung",2,2,2,1600000000,105,115,7.138017173
"Rumah Kantor 2 Lantai SHM di Mainroad Pasir Impun, Bandung","Mandalajati, Bandung",1,3,4,4000000000,560,500,7.138017173
"Rumah 2 Lantai Baru SHM di Paisir Impun, Bandung","Mandalajati, Bandung",2,1,2,1300000000,99,160,7.138017173
Jual Rumah Bagus dan Luas di Pasir impun Bandung,"Mandalajati, Bandung",3,3,5,1800000000,340,120,7.138017173
Rumah Dijual Jatihandap Bandung Mewah Siap Huni,"Mandalajati, Bandung",6,5,6,4200000000,750,400,7.138017173
Rumah Town House Sindanglaya Arcamanik Kota Bandung,"Mandalajati, Bandung",2,1,0,435000000,57,36,7.138017173
Rumah 2 Lt Samha Town House Sindanglaya Arcamanik Kota Bandung,"Mandalajati, Bandung",2,2,0,530000000,57,55,7.138017173
Rumah Free Desain 2 Lantai Cluster Jatihandap Kota Bandung,"Mandalajati, Bandung",2,2,0,534000000,51,50,7.138017173
Rumah di Jatihandap jual murah,"Mandalajati, Bandung",3,3,1,1200000000,92,100,7.138017173
Rumah Minimalis Cash KPR di Jatihandap Kodya Bandung,"Mandalajati, Bandung",2,1,1,495000000,60,40,7.138017173
Dijual Rumah Lux Jatihandap di Jalan Jati Asri Bandung Jawa Barat,"Mandalajati, Bandung",6,5,6,4200000000,750,400,7.138017173
Rumah dijual di Jl pasir impun mandalajati kota bandung 3 Lantai SHM Timur Laut,"Mandalajati, Bandung",3,3,1,1650000000,122,184,7.138017173
Rumah Murah di Jual Tamansari Bukit Bandung,"Mandalajati, Bandung",3,2,0,1800000000,160,100,7.138017173
Dijual rumah baru di jatihandap ,"Mandalajati, Bandung",2,1,0,350000000,50,30,7.138017173
RUMAH BARU SIAP HUNI DEKAT DENGAN ARCAMANIK,"Mandalajati, Bandung",3,2,0,795000000,83,70,7.138017173
RUMAH MURAH 2 LANTAI DEKAT DENGAN  TERMINAL CICAHEUM,"Mandalajati, Bandung",3,2,0,450000000,58,36,7.138017173
Di jual rumah dengan gaya modern lokasi strategis 3 Lantai SHM,"Mandalajati, Bandung",5,1,1,6500000000,868,600,7.138017173
Rumah Dijual 2 Lantai di Pasir Impun Bandung,"Mandalajati, Bandung",4,2,1,1500000000,175,2200,7.138017173
RUMAH MEWAH DI SINDANGJAYA MANDALAJATI ,"Mandalajati, Bandung",5,4,4,6500000000,860,600,7.138017173
Rumah Baru Murah Bangunan Indrusial Padasuka,"Mandalajati, Bandung",2,1,1,590000000,75,40,7.138017173
Rumah di Jatihandap 2 Lantai SHM jual murah,"Mandalajati, Bandung",5,3,0,1400000000,150,280,7.138017173
Rumah di Jatihandap jual mura 2 Lantai,"Mandalajati, Bandung",3,3,1,1400000000,92,100,7.138017173
Rumah Halaman Besar Luas Tanahnya 750 m² di Jatihandap,"Mandalajati, Bandung",6,5,6,4200000000,750,400,7.138017173
Rumah 2 Lantai di Cluster Tamansari Bukit Bandung Blok 8,"Mandalajati, Bandung",5,3,1,2000000000,160,250,7.138017173
"Rumah + Furnished di City Garden Residence Blok E Pupr, Cicaheum","Mandalajati, Bandung",3,2,1,950000000,60,60,7.138017173
Jual Rumah Mungil Siap Huni Bandung City View ,"Mandalajati, Bandung",2,1,1,800000000,94,56,7.138017173
Rumah Kos Kost Besar 17 Kamar di Jl Pasir Impun,"Mandalajati, Bandung",17,17,4,4440000000,782,604,7.138017173
Rumah minimalis dengan suasana yg masih asri ,"Mandalajati, Bandung",2,1,1,680000000,98,75,7.138017173
Di jual rumah minimalis,"Mandalajati, Bandung",2,1,1,835000000,93,60,7.138017173
Jual rumah jatihandap lokasi strategis  murah,"Mandalajati, Bandung",2,1,1,400000000,90,50,7.138017173
Rumah Minimalis View Pegunungan di Arcamanik Mandalajati Bandung,"Mandalajati, Bandung",2,1,1,835000000,93,60,7.138017173
Rumah Cluster Udara Sejuk Dengan Pemandangan Kota,"Mandalajati, Bandung",2,2,1,1300000000,105,80,7.138017173
"Rumah Baru 2 lantai Ready Tamansari Bukit Bandung 80/106 SHM 1,5 M","Mandalajati, Bandung",0,0,0,1500000000,106,80,7.138017173
Jual rumah minimalis siap huni murah masuk kotamadya,"Mandalajati, Bandung",2,1,1,485000000,60,50,7.138017173
"Rumah Mega Regency Cikadut Dekat Arcamanik, Cicaheum,","Mandalajati, Bandung",2,2,0,720000000,83,90,7.138017173
Rumah Baru Asri Skandinavian Di Pasir Impun 8 Menit Ke Rs Hermina,"Mandalajati, Bandung",3,2,2,2200000000,230,98,7.138017173
RUMAH SIAP HUNI KOMPLEK SUKAASIH KEL SINDANG JAYA KEC MANDALA JATI KOTA BANDUNG TIMUR  JAWA BARAT,"Mandalajati, Bandung",0,0,0,1300000000,150,125,7.138017173
Rumah Siap Huni jati handap Kota bandung,"Mandalajati, Bandung",2,1,1,550000000,90,36,7.138017173
Dijual Rumah Fully Furnished di Cluster Ekslusif Pasir Impun Bandung Kota,"Mandalajati, Bandung",3,4,1,1600000000,121,174,7.138017173
" Murah Rumah Siap Huni di Jl. Arcamanik, Bandung","Mandalajati, Bandung",2,2,5,6900000000,600,150,7.138017173
"Rumah pinggir Jalan Utama Pasir Impun 1,6 M","Mandalajati, Bandung",5,1,1,1600000000,180,175,7.138017173
"Rumah Siap Renovasi di Jatihandap Padasuka,bandung","Mandalajati, Bandung",3,2,1,950000000,90,120,7.138017173
Rumah 2 Lantai di Bukit Tamansari Jl.ah Nasution Bandung Timur,"Mandalajati, Bandung",4,3,1,2500000000,153,200,7.138017173
Rumah Dijual Minmalis Cantik di Pasir Impun,"Mandalajati, Bandung",2,2,0,1100000000,72,80,7.138017173
"HUNIAN DI JATIHANDAP DP 15 JT ALL IN CICILAN 3,5 JT DKT CICAHEUM","Mandalajati, Bandung",3,2,1,875000000,60,60,7.138017173
"Rumah Siap Huni Nyaman Pasir Impun, Bandung","Mandalajati, Bandung",4,2,0,2000000000,200,120,7.138017173
"Dijual Dua Rumah Baru Rendeng Main Road Pasir Impun, Bandung","Mandalajati, Bandung",2,2,0,1650000000,105,140,7.138017173
Rumah Bagus Murah di Kompleks Tamansari Bukit Bandung,"Mandalajati, Bandung",3,2,1,1800000000,160,100,7.138017173
Rumah Siap Huni Dalam Komplek Pasir Impun,"Mandalajati, Bandung",3,2,2,1100000000,90,96,7.138017173
Rumah Nyaman Siap Huni Komplek Bandung Timur Cocok Huni Keluarga,"Mandalajati, Bandung",2,1,1,830000000,93,75,7.138017173
Promo Rumah Baru 2 Lantai Cluster Jatihandap Kota Bandung Rq,"Mandalajati, Bandung",2,2,1,534000000,51,50,7.138017173
"Dijual Cepet Rumah Bagus Nyaman Harga Terbaik di Bandung,kota","Mandalajati, Bandung",2,1,1,650000000,98,66,7.138017173
Rumah Dijual di Komplek Grand Panoramic Pasir Impun Bandung,"Mandalajati, Bandung",3,3,1,1630000000,120,150,7.138017173
Rumah Nyaman Siap Huni Di Jatihandap Bandung ini Bun,"Mandalajati, Bandung",2,1,1,454000000,82,36,7.138017173
Dijual Rumah 2 Lantai Baru Siap Huni Pasir Impun Bandung Timur,"Mandalajati, Bandung",3,2,1,680000000,98,75,7.138017173
Dijual Rumah Cantik Di Pasir Impun Bandung ,"Mandalajati, Bandung",0,2,2,1750000000,109,162,7.138017173
Dijual Rumah Di Pasir Impun Bandung ,"Mandalajati, Bandung",3,2,0,1200000000,84,100,7.138017173
Rumah Hook Ada Pool Mini di Perumahan Tamansari Bukit Bandung,"Mandalajati, Bandung",4,3,2,3900000000,232,400,7.138017173
 Rumah Unfurnished Terawat di Sindanglaya Dekat Apotek Hosana,"Mandalajati, Bandung",5,3,0,1500000000,150,112,7.138017173
Rumah minimalis bangunan baru di jatihandap kota bandung ,"Mandalajati, Bandung",2,1,1,528000000,66,33,7.138017173
Rumah di pasir impun jual cepat siap huni,"Mandalajati, Bandung",3,2,1,1600000000,105,95,7.138017173
Rumah 2 Lantai Besar Dikomplek Elite Tamansari Bukit Bandung,"Mandalajati, Bandung",10,7,2,6500000000,564,480,7.138017173
Rumah Hook Dikomplek Tamansari Bukit Bandung One Gate System,"Mandalajati, Bandung",4,4,2,3500000000,360,178,7.138017173
Rumah Nyaman Dan Asri Dikomplek Tamansari Bukit Bandung ,"Mandalajati, Bandung",3,1,1,1800000000,160,100,7.138017173
Rumah SHM Bagus di green valley residence,"Mandalajati, Bandung",1,1,1,500000000,60,22,7.138017173
Rumah Siap Huni Bumi Panyieukan Cipadung Kidul Bandung,"Panyileukan, Bandung",4,2,1,1600000000,102,200,11.8780796
Rumah minimalis di cluster panyileukan cibiru dkt gor gbla blkg polda,"Panyileukan, Bandung",3,2,2,700000000,119,80,11.8780796
Rumah siap huni di Pangaritan antapani dekat polda,"Panyileukan, Bandung",5,3,1,1000000000,162,120,11.8780796
Jual Rumah Nyaman di Panyileukan Bandung Kota,"Panyileukan, Bandung",4,3,1,1100000000,162,120,11.8780796
3 Unit Rumah Baru Ready Stock di Bumi Panyileukan Kota Bandung,"Panyileukan, Bandung",2,1,1,675000000,100,50,11.8780796
Dijual Rumah 300 Jutaan Termurah di Komplek Bumi Panyileukan,"Panyileukan, Bandung",3,2,1,390000000,60,45,11.8780796
Rumah baru 2 lantai siap hi I panyileukan Kota bandung ,"Panyileukan, Bandung",3,2,2,860000000,91,95,11.8780796
Rumah baru shm Scandinavian smart home di panyileukan bandung ,"Panyileukan, Bandung",2,1,1,695000000,87,42,11.8780796
Rumah baru 2 lantai shm townhouse panyileukan bandung ,"Panyileukan, Bandung",3,2,1,857000000,79,68,11.8780796
Rumah baru shm minimalis di panyileukan Kota bandung jawa barat ,"Panyileukan, Bandung",2,1,1,585000000,45,72,11.8780796
DIJUAL FULLFURNISH PAVILIUN+ KOSKOSAN TERISI PENUH DI PANYILEUKAN,"Panyileukan, Bandung",27,14,2,4200000000,216,450,11.8780796
"MURAH. Dijual Rumah Siap Huni di Panyileukan, Bandung","Panyileukan, Bandung",4,3,1,1100000000,162,120,11.8780796
D P 29 Juta All In Rumah Cipadung Cibiru Dekat P O L D A Jabar.,"Panyileukan, Bandung",2,1,1,532000000,48,41,11.8780796
 Rumah 2 Lantai Terawat Nyaman di Bumi Panyileukan Bandung,"Panyileukan, Bandung",4,1,0,1800000000,105,250,11.8780796
"Murah Jual Cepat Rumah Bagus SHM di Panyileukan , Bandung","Panyileukan, Bandung",7,3,1,935000000,152,300,11.8780796
Rumah 2Lt panyileukan Bandung dijual cepat,"Panyileukan, Bandung",2,1,0,675000000,63,70,11.8780796
Rumah Murah Dekat Gbla Mesjid Al Jabar Panyileukan Bandung,"Panyileukan, Bandung",5,2,1,935000000,152,300,11.8780796
Bu Rumah Besar 2 Lt di Panyileukan Dkt Ujungberung Bandung Kota,"Panyileukan, Bandung",4,2,1,900000000,102,120,11.8780796
Rumah Baru Cluster di Komplek Bumi Panyileukan Kota Bandung ,"Panyileukan, Bandung",3,2,1,857000000,79,68,11.8780796
Dijual Cepat Rumah Baru 2lt Minimalis di Komplek Panyileukan Bdg,"Panyileukan, Bandung",3,2,0,900000000,84,83,11.8780796
Rumah 1 Lantai di Panyileukan Cipadung Kulon,"Panyileukan, Bandung",3,2,1,900000000,143,130,11.8780796
Rumah Dalam Komplek Citra Indah Panyileukan Bandung,"Panyileukan, Bandung",3,3,1,850000000,155,100,11.8780796
Rumah Di Panyileukan Kota Bandung,"Panyileukan, Bandung",8,8,2,1500000000,100,160,11.8780796
"Rumah 2,5 Lantai SHM Bagus Strategis Bisa Untuk Usaha di Bumi Panyileukan Bandung","Panyileukan, Bandung",5,3,3,2150000000,212,170,11.8780796
Rumah 2 Lantai di Panyileukan Bandung Timur,"Panyileukan, Bandung",4,4,1,2000000000,130,250,11.8780796
Dijual Rumah Bumi Panyileukan Dekat Labschool Upi Dkt Kampus Upi,"Panyileukan, Bandung",4,3,1,1000000000,102,100,11.8780796
"Rumah Baru 2 Lantai di Panyileukan, Bandung","Panyileukan, Bandung",2,1,1,935000000,95,65,11.8780796
Jual cpt MURAH diBumi panyileukan SHM Butuh Renovasi Selatan,"Panyileukan, Bandung",2,1,1,275000000,6,45,11.8780796
Rumah di Komplek Riung Bandung 2 Lantai siap huni Bagus,"Panyileukan, Bandung",3,2,1,650000000,72,120,11.8780796
Rumah Siap Huni di dalam Cluster Komplek Panyileukan di Jl.Soekarno Hatta 2 Lantai Kota Bandung,"Panyileukan, Bandung",4,2,2,1100000000,126,100,11.8780796
Di Jual Rumah Minimalis Cluster Andalus Residence Bandung Timur,"Panyileukan, Bandung",2,1,1,545000000,84,62,11.8780796
"Siap Huni Rumah di Panyileukan, Kota Bandung ALL-IN","Panyileukan, Bandung",3,3,1,850000000,81,92,11.8780796
Jual Rumah 2 Lantai Di Komplek Panyilekan Citra Lokasi Strategis,"Panyileukan, Bandung",5,3,0,2130000000,266,200,11.8780796
Rumah 3lt. Siap Huni di Griya Cempaka Arum Dekat Masjid Al Jabbar,"Panyileukan, Bandung",2,1,1,1200000000,84,200,11.8780796
Rumah Baru Dijual di Komplek Bumi Panyileukan Cibiru Bandung SHM,"Panyileukan, Bandung",3,2,1,898000000,100,90,11.8780796
Rumah Murah Mininamalis di Bumi Panyileukan ,"Panyileukan, Bandung",2,1,1,611000000,104,40,11.8780796
"DIJUAL RUMAH MURAH!! SIAP HUNI, CLUSTER, SAMPING GBLA, PANYIULEKAN. KOTA BANDUNG","Panyileukan, Bandung",2,1,1,725000000,90,90,11.8780796
Rumah Baru Di Panyileukan Dekat Ke Pinus Regency Gedebage Bandung,"Panyileukan, Bandung",3,2,1,799000000,95,66,11.8780796
Rumah Murah Dan Luas di Bumi Panyileukan Bandung,"Panyileukan, Bandung",2,1,1,565000000,86,40,11.8780796
Dijual Rumah Modern Minimalis di Panyileukan Dekat Soetta Bandung,"Panyileukan, Bandung",4,3,1,1100000000,162,120,11.8780796
Hunian Nyaman Islami Dekat Alun2 Ujungberung Dan Kampus U I N,"Panyileukan, Bandung",3,2,1,693000000,66,60,11.8780796
Rumah 2lt Dekat Mesjid Al Jabar Bebas Banjir Ada Ruang Usaha,"Panyileukan, Bandung",4,2,1,1290000000,126,126,11.8780796
Murah Strategis Rumah 2 Lt di Panyileukan Dkt Ujungberung Bandung,"Panyileukan, Bandung",2,2,1,532000000,48,42,11.8780796
Jual Rumah Bumi Panyileukan,"Panyileukan, Bandung",3,1,0,650000000,95,70,11.8780796
Rumah Mewah Keamanan Terjamin di Bumi Panyileukan,"Panyileukan, Bandung",7,3,1,920000000,152,300,11.8780796
Dijual Rumah Minimalis Modern Dalam Cluster Di Panyileukan,"Panyileukan, Bandung",2,2,1,750000000,63,90,11.8780796
Dijual Rumah Kost Potensial 2 Lantai di Panyileukan Kota Bandung,"Panyileukan, Bandung",15,5,0,800000000,189,189,11.8780796
Rumah Mewah di Panyileukan Dlm Cluster Dekat Kampus Uin Polda Jabar,"Panyileukan, Bandung",3,2,1,857000000,79,68,11.8780796
Rumah 2 lantai deket pusat kota ,"Panyileukan, Bandung",3,2,1,700000000,95,65,11.8780796
Dijual Rumah Siap Huni Sayap Jl.ah Nasution Bandung Kota,"Panyileukan, Bandung",1,3,4,5000000000,560,500,11.8780796
Rumah Murah Mainroad Area Panyileukan Gedebage Bandung,"Panyileukan, Bandung",5,3,3,3500000000,399,300,11.8780796
Rumah Bagus Di Panyileukan Kota Bandung,"Panyileukan, Bandung",3,2,1,1250000000,90,150,11.8780796
Rumah Kost Produktif di Cimencrang Panyileukan.lokasi Strategis,"Panyileukan, Bandung",8,6,1,1600000000,100,160,11.8780796
Rumah Cantik Siap Huni di Butik Panyileukan,"Panyileukan, Bandung",3,2,1,1070000000,108,100,11.8780796
Rumah + Cafe Bumi Panyileukan Raya SHM,"Panyileukan, Bandung",4,3,1,4500000000,413,400,11.8780796
RUMAH BAGUS TERAWAT SIAP HUNI DI PANYILEUKAN,"Panyileukan, Bandung",3,2,2,949000000,100,108,11.8780796
Rumah Strategis di Panyileukan kota Bandung ,"Panyileukan, Bandung",4,3,1,1100000000,162,120,11.8780796
Rumah Di Komplek Bumi Panyilekan Setengah Lantai Strategis Dan Depan Dibikin Warung Untuk Usaha Lokasi Strategis Dekat Ke Std Gbla Toll Gedebage ,"Panyileukan, Bandung",3,1,1,45000000,84,110,11.8780796
D P 29 Juta All In Rumah Cipadung Cibiru Dekat P O L D A Jabar.,"Panyileukan, Bandung",2,1,1,532000000,48,41,11.8780796
"Rumah 2 Lantai Minimalis di Bumi Panyileukan Residence, Bandung","Panyileukan, Bandung",3,2,1,975000000,108,100,11.8780796
Rumah Cluster Di Griya Cempaka Arum Dekat Mesjid Raya Al-Jabar,"Panyileukan, Bandung",2,1,1,725000000,90,90,11.8780796
RUMAH READY STOCK 2 Lt DI PANYILEUKAN KOTA BANDUNG DEKAT KCIC ,"Panyileukan, Bandung",3,2,1,860000000,91,95,11.8780796
"Rumah Asri 2 Lantai Bagus SHM Bumi Panyileukan,bandung","Panyileukan, Bandung",4,4,1,1570000000,102,200,11.8780796
"Rumah 2 Lantai Bagus SHM di panyileukan, Bandung","Panyileukan, Bandung",3,2,1,1100000000,108,100,11.8780796
Dijual Rumah Bagus 2 Lantai Di Komp. Bumi Panyileukan,"Panyileukan, Bandung",4,2,1,2000000000,102,200,11.8780796
 Rumah Baru Unfurnished di Panyileukan  SHM - Sertifikat Hak Milik,"Panyileukan, Bandung",3,3,1,875000000,81,92,11.8780796
Rumah bagus 2Lantai di jual di panyileukan,"Panyileukan, Bandung",2,1,1,670000000,63,70,11.8780796
Rumah Lux On Progres di Panyileukan Skhatta Bandung,"Panyileukan, Bandung",3,3,1,989000000,99,90,11.8780796
Jual rumah 2 lantai di panyileukan bandung,"Panyileukan, Bandung",7,2,1,935000000,152,300,11.8780796
Rumah Smarthome Aesthetic Di Bumi Panyileukan Bandung Siap Huni,"Panyileukan, Bandung",2,1,1,650000000,87,42,11.8780796
Rumah Baru 1 Lantai Siap Huni Di Komplek Bumi Panyileukan Bandung,"Panyileukan, Bandung",2,1,1,560000000,86,40,11.8780796
Rumah Lagi Dibangun di Komplek Panyileukan Indah Bandung,"Panyileukan, Bandung",3,2,1,895000000,100,90,11.8780796
Rumah Cantik Minimalis Modern Dalam Cluster di Panyileukan ,"Panyileukan, Bandung",2,2,1,750000000,63,90,11.8780796
Rumah siap huni di bandung timur SHM Bagus,"Panyileukan, Bandung",4,3,1,1100000000,162,120,11.8780796
Dijual Rukost Di Jl Teratai Cipadung Kidul Kota Bandung,"Panyileukan, Bandung",20,20,0,2500000000,251,500,11.8780796
Dijual Rumah Bumi Panyileukan Dekat Labschool Upi Dkt Kampus Upi,"Panyileukan, Bandung",4,3,1,1000000000,102,100,11.8780796
"Dijual Rumah Di Dalam Cluster, Jalan Utama Citra Panyileukan, Bdg","Panyileukan, Bandung",4,3,1,2500000000,140,240,11.8780796
Rumah Baru Siap Huni di Panyileukan Soekarno Hatta Bandung,"Panyileukan, Bandung",2,1,1,675000000,100,50,11.8780796
Dijual Rumah Bagus Di Komplek Panyileukan Residence Kota Bandung,"Panyileukan, Bandung",3,2,0,1100000000,108,100,11.8780796
Rumah + Kosan Bagus Lokasi Strategis Panyileukan Kota Bandung,"Panyileukan, Bandung",8,8,1,1390000000,100,160,11.8780796
"Teratai, Panyileukan, Gbla, Masjid Al jabbar. Rumah Dan Kost Di Bandung Timur, Kota Bandung","Panyileukan, Bandung",12,10,2,1950000000,338,280,11.8780796
Dijual Rumah Bagus Bumi Panyileukan Hunian Nyaman Bandung Timur,"Panyileukan, Bandung",4,2,1,1900000000,102,200,11.8780796
Rumah Siap Huni 2 Lantai Di Panyileukan Dekat Polda Jabar Bandung,"Panyileukan, Bandung",3,2,1,875000000,92,82,11.8780796
Rumah Siap Huni 2 Lantai Di Bumi Panyileukan Polda Jabar Bandung,"Panyileukan, Bandung",3,2,1,875000000,91,81,11.8780796
Rumah Modern Komplek Bumi Panyileukan,"Panyileukan, Bandung",4,3,2,1500000000,126,240,11.8780796
Rumah Design Baru Di Bumi Panyileukan Dekat Ke Gedebage Bandung,"Panyileukan, Bandung",2,2,1,845000000,70,86,11.8780796
Rumah 2 Lantai Siap Huni Di Komplek Bumi Panyileukan Bandung SHM,"Panyileukan, Bandung",2,2,1,849000000,88,70,11.8780796
"Rumah Oslo House di Jl Terusan Panyileukan Bandung Timur,","Panyileukan, Bandung",2,1,1,695000000,80,42,11.8780796
Rumah Kost Bagus Roi Tinggi Cocok Untuk Investasi di Panyileukan,"Panyileukan, Bandung",27,14,2,4200000000,216,450,11.8780796
Rumah Siap Huni di Bumi Panyileukan Bandung,"Panyileukan, Bandung",5,3,1,1100000000,102,100,11.8780796
Rumah Siap Huni Lokasi Strategis di Bumi Panyileukan Bandung,"Panyileukan, Bandung",5,3,1,1100000000,102,70,11.8780796
Hunian Nyaman Dekat Alun Alun Ujungberung Dan P O L D A Jabar,"Panyileukan, Bandung",3,2,1,693000000,66,60,11.8780796
Rumah Minimalis 2 Lantai Siap Huni di Butik Panyileukan ,"Panyileukan, Bandung",3,2,1,1000000000,108,100,11.8780796
Rumah Baru Murah Siap Huni di Bumi Panyileukan 500 Jutaan Bandung Timur,"Panyileukan, Bandung",2,1,1,560000000,86,40,11.8780796
D P 29 Juta All In Rumah Cipadung Cibiru Dekat P O L D A Jabar.,"Panyileukan, Bandung",2,1,1,532000000,48,41,11.8780796
DIJUAL RUMAH ASRI TERAWAT FULL KAYU JATI DI BUMI PANYILEUKAN ,"Panyileukan, Bandung",3,2,1,1570000000,102,180,11.8780796
Rumah Baru di Jalan Panyileukan kota Bandung,"Panyileukan, Bandung",2,1,1,585000000,60,45,11.8780796
Rumah 1 Lantai di Panyileukan Cipadung Kulon,"Panyileukan, Bandung",3,2,0,900000000,143,130,11.8780796
"Rumah 2,5 Lantai SHM Bagus Strategis Bisa Untuk Usaha di Bumi Panyileukan Bandung","Panyileukan, Bandung",5,3,0,2150000000,212,170,11.8780796
Rumah Siap Huni 2 Lantai Cluster Panyileukan 600 Jutaan ,"Panyileukan, Bandung",0,0,0,699000000,63,78,11.8780796
Dijual Rumah Baru Lt140/120 Harga850jt di Komplek Bandung Kotamadya,"Rancasari, Bandung",0,0,0,850000000,140,122,8.828200518
Komplek Metro Margahayu Raya Rumah Di Soetta Buahbatu Bandung,"Rancasari, Bandung",4,2,1,1100000000,150,200,8.828200518
DIJUAL CEPAT RUMAH DI KOMPLEK MARGAHAYU RAYA DEKAT METRO,"Rancasari, Bandung",3,2,1,895000000,144,120,8.828200518
"Komplek Margahayu Raya, Rancasari, Metro Soekarno Hatta, Kota Bandung. Dekat Rs Edelweiss","Rancasari, Bandung",4,5,2,2200000000,233,280,8.828200518
MURAH RUMAH SIAP HUNI MARGAHAYU RAYA BARAT SO,"Rancasari, Bandung",2,1,1,825000000,140,94,8.828200518
Rumah bagus di Riung Bandung Bypass. Murah,"Rancasari, Bandung",3,2,1,690000000,99,100,8.828200518
Dijual rumah lt120/120 hrg875 di depan komp grand Sharon Bandung,"Rancasari, Bandung",0,0,0,875000000,120,120,8.828200518
For Sale Rumah Tinggal Di Komplek Pasir Pogor Bandung,"Rancasari, Bandung",3,2,0,850000000,121,100,8.828200518
Dijual Murah Lt100 90 Harga 475jt Rm di Riung Bandung Soekarno Hatta,"Rancasari, Bandung",0,0,0,475000000,100,90,8.828200518
Dijual Cepat! Rumah Jupiter Margahayu dekat MTC Hadap Timur,"Rancasari, Bandung",4,3,1,1200000000,123,100,8.828200518
Rumah cantik siap huni perumahan nyaman dan aman Santosa Asih Cipamokolan,"Rancasari, Bandung",7,2,0,1300000000,163,200,8.828200518
Rumah Di Cluster Asri One Gate System Di Riung Bandung,"Rancasari, Bandung",2,1,1,650000000,77,50,8.828200518
"Dijual Rumah Baru, Cluster, Murah 525jt Kota Bandung Ciwastra Rancasari","Rancasari, Bandung",2,1,1,525000000,75,40,8.828200518
Rumah Pondok Indah Baturaden Rancasari Dijual Cepat Via Lelang,"Rancasari, Bandung",3,2,1,676000000,135,158,8.828200518
Murah Rumah di Komplek Pondok Indah Baturaden Rancasari,"Rancasari, Bandung",3,2,1,676000000,135,158,8.828200518
Rumah Terawat Nyaman Dan Aman di Riung Bandung,"Rancasari, Bandung",2,2,0,950000000,108,216,8.828200518
Naksir Keren Rumah Bagus Di Area Rancasari Bandung Kota,"Rancasari, Bandung",5,3,1,1450000000,136,200,8.828200518
Dijual Rumah Nyaman 3 Lantai di Riung Bandung,"Rancasari, Bandung",3,3,0,900000000,72,164,8.828200518
Rumah 2lt Terawat di Cluster Riung Bandung,"Rancasari, Bandung",3,2,1,1500000000,150,187,8.828200518
Rumah hook siap huni lokasi mainroad di Cipamokolan ,"Rancasari, Bandung",6,5,1,12000000000,450,300,8.828200518
Dijual Rumah 2 Lantai di Komplek Riung Gede Permai Riung Bandung,"Rancasari, Bandung",4,2,0,1300000000,112,120,8.828200518
Rumah mewah Baru di summarecon Bandung dekat masji agung al jabar,"Rancasari, Bandung",4,3,2,3200000000,150,165,8.828200518
Rumah Siap Huni Di Kawasan Riung Bandung Dijual,"Rancasari, Bandung",2,1,1,525000000,60,60,8.828200518
Dijual Cepat Rumah Termurah 700 Jutaan di Grand Sharon Residence,"Rancasari, Bandung",2,1,1,740000000,78,45,8.828200518
Dijual Rumah 1 Lantai di Grand Sharon Residence Rancasari Bandung,"Rancasari, Bandung",2,2,1,1400000000,122,80,8.828200518
Dijual Rumah Kokoh Terawat 2 Lantai di Grand Sharon Kota Bandung,"Rancasari, Bandung",3,3,1,1900000000,144,130,8.828200518
Dijual Cepat Rumah di Grand Sharon Residence Cipamokolan Bandung,"Rancasari, Bandung",3,2,1,1400000000,105,120,8.828200518
Parah Sih Ini.. Rumah Keren Nyaman Untuk Keluarga di Rancasari,"Rancasari, Bandung",8,3,0,2800000000,280,180,8.828200518
